OG0002070	PSC76303.1 DEAD-box ATP-dependent RNA helicase 7 [Micractinium conductrix]	KAF8072416.1 hypothetical protein HT031_000075 [Scenedesmus sp. PABB004], KAF8070884.1 DEAD-box ATP-dependent RNA helicase 7 [Scenedesmus sp. PABB004]
OG0002071	PSC72338.1 tubulin tyrosine ligase [Micractinium conductrix]	KAF8065549.1 ttll6 [Scenedesmus sp. PABB004]
OG0002072	PSC70510.1 porphobilinogen deaminase [Micractinium conductrix]	KAF8063031.1 hypothetical protein HT031_003870 [Scenedesmus sp. PABB004]
OG0002073	PSC72287.1 40S ribosomal S16 [Micractinium conductrix]	KAF8061352.1 DGAT1-2 [Scenedesmus sp. PABB004]
OG0002074	PSC68908.1 putative ribosome biogenesis RLP24 [Micractinium conductrix]	KAF8071165.1 rlp24 [Scenedesmus sp. PABB004]
OG0002075	PSC73941.1 inositol-3-phosphate synthase [Micractinium conductrix]	KAF8064501.1 IPS2 [Scenedesmus sp. PABB004]
OG0002076	PSC74976.1 EH domain-containing 1-like [Micractinium conductrix]	KAF8073195.1 EHD1 [Scenedesmus sp. PABB004]
OG0002077	PSC74722.1 serine threonine-kinase [Micractinium conductrix]	KAF8071371.1 DRC3 [Scenedesmus sp. PABB004]
OG0002078	PSC76842.1 carbohydrate-binding module family 20 [Micractinium conductrix]	KAF8059142.1 hypothetical protein HT031_005314 [Scenedesmus sp. PABB004]
OG0002079	PSC73718.1 cell wall integrity scw1 [Micractinium conductrix]	KAF8072434.1 hypothetical protein HT031_000093 [Scenedesmus sp. PABB004]
OG0002080	PSC68284.1 Bifunctional aspartate aminotransferase and glutamate aspartate-prephenate aminotransferase [Micractinium conductrix]	KAF8057879.1 Bifunctional aspartate aminotransferase and glutamate/aspartate-prephenate aminotransferase [Scenedesmus sp. PABB004]
OG0002081	PSC74408.1 Diphthamide biosynthesis 1 [Micractinium conductrix]	KAF8062673.1 dph1 [Scenedesmus sp. PABB004]
OG0002082	PSC72255.1 Proteasome subunit alpha type-7 [Micractinium conductrix]	KAF8073259.1 PAD1 [Scenedesmus sp. PABB004]
OG0002083	PSC72226.1 Nascent polypeptide-associated complex subunit alpha [Micractinium conductrix]	KAF8072410.1 Nascent polypeptide-associated complex subunit alpha-like protein [Scenedesmus sp. PABB004]
OG0002084	PSC76975.1 tRNA-i_6_A37 modification enzyme [Micractinium conductrix]	KAF8058056.1 miaB [Scenedesmus sp. PABB004]
OG0002085	PSC72430.1 phenol 2-monooxygenase-like isoform X1 isoform A [Micractinium conductrix], PSC72429.1 phenol 2-monooxygenase-like isoform X1 isoform B [Micractinium conductrix]	KAF8072666.1 schC [Scenedesmus sp. PABB004]
OG0002086	PSC73570.1 Bis_5 -adenosyl_-triphosphatase [Micractinium conductrix]	KAF8060584.1 hypothetical protein HT031_004761 [Scenedesmus sp. PABB004], KAF8057895.1 hypothetical protein HT031_005841 [Scenedesmus sp. PABB004]
OG0002087	PSC73643.1 importin alpha [Micractinium conductrix]	KAF8063754.1 IMPA1 [Scenedesmus sp. PABB004]
OG0002088	PSC73236.1 Crooked neck 1 [Micractinium conductrix]	KAF8063074.1 CRNKL1 [Scenedesmus sp. PABB004]
OG0002089	PSC72466.1 glutamine-tRNA ligase [Micractinium conductrix]	KAF8065733.1 Glutamine--tRNA ligase [Scenedesmus sp. PABB004]
OG0002090	PSC75430.1 Proteasome subunit alpha type-3 [Micractinium conductrix]	KAF8062974.1 PAG1 [Scenedesmus sp. PABB004]
OG0002091	PSC74029.1 glyoxylate reductase hydroxypyruvate reductase isoform X2 [Micractinium conductrix], PSC76682.1 kinase [Micractinium conductrix]	KAF8058046.1 gyaR [Scenedesmus sp. PABB004]
OG0002092	PSC71474.1 rRNA methyltransferase [Micractinium conductrix]	KAF8065501.1 SPB1 [Scenedesmus sp. PABB004]
OG0002093	PSC73836.1 glycerol-3-phosphate transporter 4 isoform A [Micractinium conductrix], PSC73835.1 glycerol-3-phosphate transporter 4 isoform B [Micractinium conductrix]	KAF8069415.1 glycerol-3-phosphate transporter 1 [Scenedesmus sp. PABB004]
OG0002094	PSC72539.1 hypothetical protein C2E20_4225 [Micractinium conductrix]	KAF8069440.1 hypothetical protein HT031_001555 [Scenedesmus sp. PABB004]
OG0002095	PSC70541.1 Proteasome subunit alpha type-5 [Micractinium conductrix]	KAF8064483.1 PAE1 [Scenedesmus sp. PABB004]
OG0002096	PSC73810.1 CHROMATIN REMODELING 4 isoform X1 isoform B [Micractinium conductrix], PSC73809.1 CHROMATIN REMODELING 4 isoform X1 isoform A [Micractinium conductrix]	KAF8073218.1 RPL7A-2 [Scenedesmus sp. PABB004]
OG0002097	PSC69987.1 3-isopropylmalate dehydrogenase [Micractinium conductrix]	KAF8067245.1 leuB [Scenedesmus sp. PABB004]
OG0002098	PSC71259.1 transport Sec24-like protein [Micractinium conductrix]	KAF8065895.1 Sec24-like protein [Scenedesmus sp. PABB004]
OG0002099	PSC73319.1 threonine-tRNA mitochondrial [Micractinium conductrix]	KAF8071057.1 hypothetical protein HT031_001139 [Scenedesmus sp. PABB004]
OG0002100	PSC67222.1 putative polyamine transporter isoform A [Micractinium conductrix], PSC67221.1 putative polyamine transporter isoform B [Micractinium conductrix]	KAF8060548.1 polyamine transporter [Scenedesmus sp. PABB004]
OG0002101	PSC75809.1 E3 ubiquitin-ligase SHPRH [Micractinium conductrix], PSC69775.1 E3 ubiquitin-ligase SHPRH isoform X1 [Micractinium conductrix]	KAF8066390.1 RAD5 [Scenedesmus sp. PABB004]
OG0002102	PSC67831.1 RER1A-like [Micractinium conductrix]	KAF8071089.1 RER1A [Scenedesmus sp. PABB004]
OG0002103	PSC70130.1 Acyl-dehydrogenase [Micractinium conductrix]	KAF8061385.1 Acad10 [Scenedesmus sp. PABB004]
OG0002105	PSC69876.1 60S ribosomal L11-1 [Micractinium conductrix]	KAF8070927.1 RPL11 [Scenedesmus sp. PABB004]
OG0002106	PSC67868.1 ADP_ATP carrier [Micractinium conductrix]	KAF8073128.1 hypothetical protein HT031_000789 [Scenedesmus sp. PABB004]
OG0002107	PSC69331.1 exocyst complex component Sec6 [Micractinium conductrix]	KAF8068183.1 SEC6 [Scenedesmus sp. PABB004]
OG0002109	PSC73129.1 2-oxoglutarate mitochondrial-like [Micractinium conductrix]	KAF8071292.1 ogdh [Scenedesmus sp. PABB004]
OG0002110	PSC73140.1 DNA repair helicase XPB1-like [Micractinium conductrix]	KAF8061119.1 XPB2 [Scenedesmus sp. PABB004]
OG0002111	PSC74072.1 AATF isoform X1 [Micractinium conductrix]	KAF8069648.1 bfr2 [Scenedesmus sp. PABB004]
OG0002112	PSC75829.1 MORN repeat family [Micractinium conductrix]	KAF8063095.1 RPL27 [Scenedesmus sp. PABB004]
OG0002115	PSC71075.1 serine decarboxylase [Micractinium conductrix]	KAF8058908.1 hypothetical protein HT031_005476 [Scenedesmus sp. PABB004]
OG0002116	PSC72623.1 DEAD-box ATP-dependent RNA helicase 20 [Micractinium conductrix]	KAF8067320.1 DEAD-box ATP-dependent RNA helicase 20 [Scenedesmus sp. PABB004]
OG0002118	PSC71042.1 small conductance mechanosensitive ion channel family isoform B [Micractinium conductrix], PSC71043.1 small conductance mechanosensitive ion channel family isoform A [Micractinium conductrix]	KAF8056020.1 CAT1 [Scenedesmus sp. PABB004]
OG0002120	PSC76466.1 conserved oligomeric Golgi complex subunit 5 [Micractinium conductrix]	KAF8065824.1 COG5 [Scenedesmus sp. PABB004]
OG0002121	PSC72914.1 glutamate 5-kinase [Micractinium conductrix]	KAF8062924.1 proB [Scenedesmus sp. PABB004]
OG0002122	PSC71203.1 ER lumen retaining receptor [Micractinium conductrix]	KAF8072943.1 ERD2B [Scenedesmus sp. PABB004]
OG0002123	PSC76082.1 hydroxyacylglutathione hydrolase [Micractinium conductrix]	KAF8058326.1 gloB [Scenedesmus sp. PABB004]
OG0002124	PSC71478.1 GTP-binding chloroplastic [Micractinium conductrix]	KAF8065613.1 OBGC1 [Scenedesmus sp. PABB004]
OG0002125	PSC71631.1 putative prefoldin subunit 3 [Micractinium conductrix]	KAF8061979.1 prefoldin subunit 3 [Scenedesmus sp. PABB004]
OG0002126	PSC69967.1 prolyl-tRNA synthetase associated domain-containing 1 [Micractinium conductrix], PSC69912.1 hypothetical protein C2E20_6610 [Micractinium conductrix]	KAF8067151.1 PRORSD1P [Scenedesmus sp. PABB004]
OG0002127	PSC71138.1 V-type proton ATPase subunit C [Micractinium conductrix]	KAF8058480.1 VHA-C [Scenedesmus sp. PABB004]
OG0002128	PSC74094.1 DEAD-box ATP-dependent RNA helicase 21 [Micractinium conductrix]	KAF8066347.1 RH21 [Scenedesmus sp. PABB004]
OG0002130	PSC68558.1 Lon protease mitochondrial [Micractinium conductrix]	KAF8065961.1 lon protease [Scenedesmus sp. PABB004]
OG0002131	PSC68521.1 Alpha-ketoglutarate permease isoform B [Micractinium conductrix]	KAF8056229.1 Sf3b6 [Scenedesmus sp. PABB004]
OG0002132	PSC73762.1 mitochondrial carrier [Micractinium conductrix]	KAF8055036.1 SPAC8C9.12c [Scenedesmus sp. PABB004]
OG0002133	PSC73595.1 peptidase carboxypeptidase A [Micractinium conductrix]	KAF8071360.1 hypothetical protein HT031_001444 [Scenedesmus sp. PABB004]
OG0002134	PSC68561.1 glyoxylate succinic semialdehyde reductase chloroplastic [Micractinium conductrix]	KAF8058451.1 GLYR2 [Scenedesmus sp. PABB004]
OG0002135	PSC74147.1 hypothetical protein C2E20_2793 [Micractinium conductrix]	KAF8056346.1 psmg3 [Scenedesmus sp. PABB004]
OG0002136	PSC71813.1 RING finger 10 [Micractinium conductrix]	KAF8062682.1 rnf10 [Scenedesmus sp. PABB004]
OG0002137	PSC70686.1 DNA RNA-binding KIN17 [Micractinium conductrix]	KAF8063030.1 KIN17 [Scenedesmus sp. PABB004]
OG0002138	PSC72888.1 Calcineurin subunit B [Micractinium conductrix]	KAF8055750.1 CNB1 [Scenedesmus sp. PABB004]
OG0002139	PSC69752.1 60S ribosomal L10a-1 [Micractinium conductrix]	KAF8065433.1 RPL10A [Scenedesmus sp. PABB004]
OG0002140	PSC70084.1 Fatty acid desaturase [Micractinium conductrix], PSC74478.1 thylakoid lumenal kDa chloroplastic [Micractinium conductrix]	KAF8072752.1 thylakoid lumenal protein [Scenedesmus sp. PABB004]
OG0002141	PSC73036.1 60S ribosomal L6 [Micractinium conductrix]	KAF8060546.1 RPL6 [Scenedesmus sp. PABB004]
OG0002142	PSC69786.1 Qc-snare Syn8 Syntaxin8-family [Micractinium conductrix]	KAF8055598.1 SYP52 [Scenedesmus sp. PABB004]
OG0002143	PSC71418.1 hypothetical protein C2E20_5341 [Micractinium conductrix]	KAF8070923.1 hypothetical protein HT031_001004 [Scenedesmus sp. PABB004]
OG0002144	PSC74152.1 Metal tolerance C4 [Micractinium conductrix]	KAF8060568.1 MTPC4 [Scenedesmus sp. PABB004]
OG0002145	PSC74778.1 ATP-dependent Clp protease proteolytic subunit chloroplastic [Micractinium conductrix]	KAF8069425.1 CLPP5 [Scenedesmus sp. PABB004]
OG0002146	PSC71219.1 NAD_P_-dependent oxidoreductase [Micractinium conductrix]	KAF8072685.1 NADP-dependent 3-hydroxy acid dehydrogenase [Scenedesmus sp. PABB004]
OG0002147	PSC67474.1 hypothetical protein C2E20_8863 [Micractinium conductrix]	KAF8072848.1 rplM [Scenedesmus sp. PABB004]
OG0002148	PSC69727.1 ribosomal RNA methyltransferase NOP2 [Micractinium conductrix]	KAF8072519.1 NOP2A [Scenedesmus sp. PABB004]
OG0002149	PSC73553.1 Thymidylate kinase [Micractinium conductrix]	KAF8071262.1 hypothetical protein HT031_001345 [Scenedesmus sp. PABB004]
OG0002150	PSC69793.1 Suppressor of disruption of TFIIS [Micractinium conductrix], PSC69813.1 Mitochondrial transcription termination factor [Micractinium conductrix]	KAF8063728.1 SPAC24B11.05 [Scenedesmus sp. PABB004]
OG0002152	PSC71472.1 tyrosine sulfotransferase [Micractinium conductrix]	KAF8067374.1 hypothetical protein HT031_002422 [Scenedesmus sp. PABB004]
OG0002154	PSC69751.1 GDP-L-galactose phosphorylase 1 [Micractinium conductrix]	KAF8066170.1 VTC5 [Scenedesmus sp. PABB004]
OG0002155	PSC67471.1 Cell differentiation RCD1 [Micractinium conductrix]	KAF8057648.1 CNOT9 [Scenedesmus sp. PABB004]
OG0002156	PSC74233.1 30S ribosomal S1 [Micractinium conductrix]	KAF8072544.1 hypothetical protein HT031_000204 [Scenedesmus sp. PABB004]
OG0002157	PSC68939.1 serine-glyoxylate aminotransferase [Micractinium conductrix]	KAF8057937.1 sgaA [Scenedesmus sp. PABB004]
OG0002158	PSC71481.1 STABILIZED1-like [Micractinium conductrix]	KAF8059986.1 STA1 [Scenedesmus sp. PABB004]
OG0002159	PSC68369.1 phosphatidylinositol 3-root isoform [Micractinium conductrix]	KAF8067321.1 Phosphatidylinositol 3-kinase [Scenedesmus sp. PABB004]
OG0002160	PSC68292.1 eukaryotic translation initiation factor 2 subunit beta-like [Micractinium conductrix]	KAF8071367.1 Eukaryotic translation initiation factor 2 subunit beta [Scenedesmus sp. PABB004]
OG0002161	PSC75042.1 anthranilate synthase component [Micractinium conductrix]	KAF8058319.1 ASA1 [Scenedesmus sp. PABB004]
OG0002162	PSC74465.1 60S ribosomal L5 [Micractinium conductrix]	KAF8065432.1 RPL5 [Scenedesmus sp. PABB004]
OG0002163	PSC71402.1 conserved oligomeric Golgi complex subunit 8 [Micractinium conductrix]	KAF8070905.1 COG8 [Scenedesmus sp. PABB004]
OG0002164	PSC76593.1 small subunit processome component 20-like protein [Micractinium conductrix]	KAF8055835.1 Utp20 [Scenedesmus sp. PABB004]
OG0002165	PSC73026.1 4-alpha-glucanotransferase chloroplastic amyloplastic [Micractinium conductrix]	KAF8064499.1 DPE1 [Scenedesmus sp. PABB004]
OG0002166	PSC71246.1 WD repeat-containing 3 [Micractinium conductrix]	KAF8065837.1 wdr3 [Scenedesmus sp. PABB004]
OG0002167	PSC73087.1 transcription initiation factor IIA gamma chain [Micractinium conductrix]	KAF8063855.1 TFIIAy [Scenedesmus sp. PABB004]
OG0002168	PSC71270.1 exodeoxyribonuclease V subunit alpha [Micractinium conductrix]	KAF8072733.1 yrrC [Scenedesmus sp. PABB004]
OG0002169	PSC76450.1 eukaryotic translation initiation factor 3 subunit A-like [Micractinium conductrix]	KAF8071218.1 TIF3A1 [Scenedesmus sp. PABB004]
OG0002170	PSC75497.1 zinc finger DZIP1L isoform B [Micractinium conductrix], PSC75496.1 zinc finger DZIP1L isoform A [Micractinium conductrix]	KAF8057745.1 Dzip1l [Scenedesmus sp. PABB004]
OG0002171	PSC67724.1 carbamoyl-phosphate synthase large chloroplastic-like [Micractinium conductrix]	KAF8062674.1 hypothetical protein HT031_004003 [Scenedesmus sp. PABB004]
OG0002172	PSC75655.1 60S ribosomal L32-1 [Micractinium conductrix]	KAF8060617.1 RPL32A [Scenedesmus sp. PABB004]
OG0002173	PSC75535.1 SUPPRESSOR OF K_+_ TRANSPORT GROWTH DEFECT 1 [Micractinium conductrix]	KAF8072928.1 SKD1 [Scenedesmus sp. PABB004]
OG0002174	PSC70174.1 ser thr phosphatase [Micractinium conductrix]	KAF8073047.1 SLP1 [Scenedesmus sp. PABB004]
OG0002175	PSC67757.1 Diphthine synthase [Micractinium conductrix]	KAF8057119.1 diphthine methyl ester synthase [Scenedesmus sp. PABB004]
OG0002176	PSC75988.1 Protoheme IX mitochondrial [Micractinium conductrix]	KAF8069474.1 COX10 [Scenedesmus sp. PABB004]
OG0002177	PSC75516.1 importin subunit beta-1-like [Micractinium conductrix]	KAF8069441.1 KPNB1 [Scenedesmus sp. PABB004]
OG0002178	PSC72195.1 Beta-amylase chloroplastic [Micractinium conductrix]	KAF8060335.1 BAMY2 [Scenedesmus sp. PABB004]
OG0002179	PSC70907.1 pre-mRNA-splicing factor SPF27-like protein [Micractinium conductrix]	KAF8062947.1 MOS4 [Scenedesmus sp. PABB004]
OG0002180	PSC70249.1 Trafficking particle complex subunit 5 [Micractinium conductrix]	KAF8072777.1 trappc5 [Scenedesmus sp. PABB004]
OG0002181	PSC70937.1 putative transcriptional regulatory protein [Micractinium conductrix]	KAF8072593.1 transcriptional regulatory protein [Scenedesmus sp. PABB004]
OG0002182	PSC71508.1 Golgi apparatus membrane ECHIDNA [Micractinium conductrix]	KAF8072565.1 putative Golgi aparatus membrane protein [Scenedesmus sp. PABB004]
OG0002183	PSC73731.1 ATP synthase mitochondrial F1 complex assembly factor 1 [Micractinium conductrix]	KAF8070907.1 atpaf1 [Scenedesmus sp. PABB004], KAF8055389.1 hypothetical protein HT031_006756 [Scenedesmus sp. PABB004]
OG0002184	PSC71580.1 ATP-dependent zinc metalloprotease FTSH mitochondrial-like [Micractinium conductrix]	KAF8057660.1 FTSH8 [Scenedesmus sp. PABB004]
OG0002185	PSC73869.1 50S ribosomal L4 [Micractinium conductrix]	KAF8068376.1 RPL4 [Scenedesmus sp. PABB004]
OG0002186	PSC67365.1 epimerase family SDR39U1 chloroplastic-like isoform X2 [Micractinium conductrix]	KAF8056846.1 GC1 [Scenedesmus sp. PABB004]
OG0002187	PSC72355.1 ADP-ribosylation factor 2 [Micractinium conductrix]	KAF8061363.1 ARL3 [Scenedesmus sp. PABB004], KAF8056386.1 ARL2 [Scenedesmus sp. PABB004]
OG0002190	PSC68868.1 Adaptin ear-binding coat-associated 2 [Micractinium conductrix]	KAF8066300.1 Necap2 [Scenedesmus sp. PABB004]
OG0002191	PSC68821.1 putative tRNA _guanine_26_-N_2__-dimethyltransferase 2 isoform A [Micractinium conductrix], PSC68820.1 putative tRNA _guanine_26_-N_2__-dimethyltransferase 2 isoform B [Micractinium conductrix]	KAF8071357.1 tRNA _guanine_26_-N_2__-dimethyltransferase 1 [Scenedesmus sp. PABB004]
OG0002192	PSC76880.1 Peptidyl-prolyl cis-trans isomerase FKBP16-chloroplastic [Micractinium conductrix]	KAF8071183.1 FKBP16-3 [Scenedesmus sp. PABB004]
OG0002195	PSC67889.1 succinyl-ligase [ADP-forming] subunit alpha-mitochondrial [Micractinium conductrix]	KAF8056245.1 hypothetical protein HT031_006433 [Scenedesmus sp. PABB004]
OG0002197	PSC69868.1 adrenodoxin reductase [Micractinium conductrix]	KAF8067290.1 cyclin-C1-1 [Scenedesmus sp. PABB004]
OG0002198	PSC68341.1 Photosystem I reaction center subunit chloroplastic [Micractinium conductrix]	KAF8065754.1 hypothetical protein HT031_002814 [Scenedesmus sp. PABB004], KAF8060105.1 hypothetical protein HT031_005044 [Scenedesmus sp. PABB004]
OG0002199	PSC67375.1 rhodanese-like domain-containing chloroplastic [Micractinium conductrix]	KAF8060582.1 rhodanese-like domain-containing protein 14 [Scenedesmus sp. PABB004]
OG0002201	PSC71368.1 DDB1-and CUL4-associated factor 13 [Micractinium conductrix]	KAF8071116.1 DCAF13 [Scenedesmus sp. PABB004]
OG0002203	PSC72522.1 putative manganese-transporting ATPase PDR2 [Micractinium conductrix]	KAF8062935.1 PDR2 [Scenedesmus sp. PABB004]
OG0002204	PSC72380.1 Chromatin assembly factor 1 subunit A-A [Micractinium conductrix]	KAF8067419.1 SKIP31 [Scenedesmus sp. PABB004]
OG0002205	PSC70495.1 CCR4-associated factor [Micractinium conductrix]	KAF8056234.1 CAF1-7 [Scenedesmus sp. PABB004]
OG0002206	PSC70094.1 TRIGALACTOSYLDIACYLGLYCEROL chloroplastic-like [Micractinium conductrix]	KAF8072655.1 TGD1 [Scenedesmus sp. PABB004]
OG0002207	PSC69974.1 WD40-like domain-containing isoform B [Micractinium conductrix], PSC69975.1 WD40-like domain-containing isoform A [Micractinium conductrix]	KAF8072983.1 Nup98-96 [Scenedesmus sp. PABB004]
OG0002208	PSC75062.1 BRO1 domain-containing BROX [Micractinium conductrix]	KAF8072413.1 SERAC1 [Scenedesmus sp. PABB004]
OG0002209	PSC67385.1 arginyl-tRNA-transferase 1-like isoform A [Micractinium conductrix], PSC67384.1 arginyl-tRNA-transferase 1-like isoform B [Micractinium conductrix]	KAF8071041.1 ATE1 [Scenedesmus sp. PABB004]
OG0002210	PSC69094.1 hypothetical protein C2E20_7338 [Micractinium conductrix]	KAF8072992.1 hypothetical protein HT031_000652 [Scenedesmus sp. PABB004]
OG0002211	PSC71438.1 SNW SKI-interacting [Micractinium conductrix]	KAF8072888.1 hypothetical protein HT031_000548 [Scenedesmus sp. PABB004]
OG0002212	PSC67280.1 lipoate-ligase A isoform X1 [Micractinium conductrix]	KAF8057738.1 hypothetical protein HT031_005922 [Scenedesmus sp. PABB004]
OG0002213	PSC68639.1 F-box SKIP8 [Micractinium conductrix]	KAF8072408.1 pip [Scenedesmus sp. PABB004]
OG0002214	PSC71236.1 Bystin [Micractinium conductrix]	KAF8062016.1 hypothetical protein HT031_004276 [Scenedesmus sp. PABB004]
OG0002215	PSC72492.1 40S ribosomal S17 [Micractinium conductrix]	KAF8069420.1 RPS17 [Scenedesmus sp. PABB004]
OG0002216	PSC69155.1 Eukaryotic translation initiation factor 2D [Micractinium conductrix]	KAF8056147.1 Eif2d [Scenedesmus sp. PABB004]
OG0002217	PSC69407.1 Lysosomal alpha-mannosidase [Micractinium conductrix]	KAF8065729.1 alpha-mannosidase [Scenedesmus sp. PABB004]
OG0002218	PSC67349.1 DEAD-box ATP-dependent RNA helicase 17 [Micractinium conductrix]	KAF8071155.1 RH17 [Scenedesmus sp. PABB004]
OG0002219	PSC73737.1 LL-diaminopimelate chloroplastic [Micractinium conductrix]	KAF8072607.1 hypothetical protein HT031_000267 [Scenedesmus sp. PABB004]
OG0002220	PSC72941.1 putative phosphatase 2C 33 [Micractinium conductrix]	KAF8064671.1 protein phosphatase 2C 15 [Scenedesmus sp. PABB004]
OG0002221	PSC69170.1 SEC12 2 [Micractinium conductrix]	KAF8057275.1 hypothetical protein HT031_006083 [Scenedesmus sp. PABB004]
OG0002222	PSC67380.1 adenine nucleotide alpha hydrolase [Micractinium conductrix]	KAF8056769.1 PHOS34 [Scenedesmus sp. PABB004]
OG0002223	PSC67277.1 HSP20-like chaperone [Micractinium conductrix]	KAF8072731.1 P23-1 [Scenedesmus sp. PABB004]
OG0002224	PSC68866.1 adenylate kinase [Micractinium conductrix]	KAF8063870.1 vacuolar iron transporter 4 [Scenedesmus sp. PABB004]
OG0002225	PSC68353.1 activating signal cointegrator 1 [Micractinium conductrix]	KAF8070977.1 Trip4 [Scenedesmus sp. PABB004]
OG0002226	PSC75937.1 Zinc transporter ZIP9 isoform B [Micractinium conductrix], PSC75936.1 Zinc transporter ZIP9 isoform A [Micractinium conductrix]	KAF8065575.1 hypothetical protein HT031_003176 [Scenedesmus sp. PABB004]
OG0002227	PSC75748.1 Amidophosphoribosyltransferase [Micractinium conductrix]	KAF8059459.1 purF [Scenedesmus sp. PABB004]
OG0002228	PSC75345.1 rRNA-processing FCF1-like protein [Micractinium conductrix]	KAF8072433.1 FCF1 [Scenedesmus sp. PABB004]
OG0002229	PSC75435.1 multiple RNA-binding domain-containing 1 [Micractinium conductrix]	KAF8072432.1 mrd1 [Scenedesmus sp. PABB004]
OG0002230	PSC67238.1 Tetratricopeptide repeat 28 [Micractinium conductrix]	KAF8055469.1 TTC28 [Scenedesmus sp. PABB004]
OG0002231	PSC68608.1 thioredoxin domain-containing PLP3B-like [Micractinium conductrix]	KAF8073249.1 PLP3B [Scenedesmus sp. PABB004]
OG0002232	PSC75631.1 lariat debranching enzyme [Micractinium conductrix]	KAF8060563.1 DBR1 [Scenedesmus sp. PABB004]
OG0002233	PSC70970.1 UDP-sugar pyrophosphorylase 1 [Micractinium conductrix]	KAF8062991.1 hypothetical protein HT031_003830 [Scenedesmus sp. PABB004]
OG0002234	PSC67903.1 putative dimethyladenosine transferase [Micractinium conductrix]	KAF8073058.1 celI [Scenedesmus sp. PABB004]
OG0002235	PSC70331.1 U3 small nucleolar ribonucleo IMP4 [Micractinium conductrix]	KAF8072765.1 Brix domain-containing protein [Scenedesmus sp. PABB004]
OG0002236	PSC73085.1 alanine-glyoxylate transaminase [Micractinium conductrix]	KAF8056849.1 ncapd2 [Scenedesmus sp. PABB004]
OG0002237	PSC70330.1 putative histone-arginine methyltransferase CARM1 isoform X1 isoform A [Micractinium conductrix], PSC70329.1 putative histone-arginine methyltransferase CARM1 isoform X1 isoform B [Micractinium conductrix]	KAF8072457.1 CARM1 [Scenedesmus sp. PABB004]
OG0002238	PSC74942.1 26S proteasome non-ATPase regulatory subunit 6-like protein [Micractinium conductrix]	KAF8061118.1 RPN7 [Scenedesmus sp. PABB004]
OG0002241	PSC68986.1 40S ribosomal S14-2 [Micractinium conductrix]	KAF8063681.1 RPS14 [Scenedesmus sp. PABB004]
OG0002243	PSC67734.1 CTP synthase [Micractinium conductrix]	KAF8062710.1 ctps [Scenedesmus sp. PABB004]
OG0002244	PSC67922.1 28S ribosomal mitochondrial-like [Micractinium conductrix]	KAF8055919.1 hypothetical protein HT031_006558 [Scenedesmus sp. PABB004]
OG0002245	PSC70398.1 elongation factor 2 [Micractinium conductrix]	KAF8069442.1 Elongation factor 2 [Scenedesmus sp. PABB004]
OG0002246	PSC76153.1 RNA binding _nucleomorph_ [Micractinium conductrix]	KAF8057251.1 TIC56 [Scenedesmus sp. PABB004]
OG0002247	PSC67846.1 hypothetical protein C2E20_8517 isoform C [Micractinium conductrix], PSC67848.1 hypothetical protein C2E20_8517 isoform A [Micractinium conductrix], PSC67847.1 hypothetical protein C2E20_8517 isoform B [Micractinium conductrix]	KAF8059404.1 FTSJ1 [Scenedesmus sp. PABB004]
OG0002248	PSC70187.1 ubiquitin-specific protease 10 [Micractinium conductrix]	KAF8056355.1 UBP11 [Scenedesmus sp. PABB004], KAF8072770.1 UBP11 [Scenedesmus sp. PABB004]
OG0002249	PSC68572.1 phosphatase 2C 71 [Micractinium conductrix]	KAF8056105.1 protein phosphatase 2C 45 [Scenedesmus sp. PABB004]
OG0002250	PSC68979.1 TATA-box binding -interacting TOUGH isoform A [Micractinium conductrix], PSC68980.1 TATA-box binding -interacting TOUGH isoform B [Micractinium conductrix]	KAF8066267.1 G patch domain-containing protein [Scenedesmus sp. PABB004]
OG0002251	PSC72049.1 dnaJ-like protein subfamily C GRV2 isoform X1 isoform A [Micractinium conductrix], PSC72050.1 dnaJ-like protein subfamily C GRV2 isoform X1 isoform B [Micractinium conductrix]	KAF8069423.1 GRV2 [Scenedesmus sp. PABB004]
OG0002252	PSC72083.1 histone H3 Lys 36 methyltransferase ASH1 isoform A [Micractinium conductrix], PSC72082.1 histone H3 Lys 36 methyltransferase ASH1 isoform B [Micractinium conductrix]	KAF8060074.1 ASHH1 [Scenedesmus sp. PABB004]
OG0002254	PSC75037.1 short chain dehydrogenase reductase family isoform A [Micractinium conductrix], PSC75038.1 short chain dehydrogenase reductase family isoform B [Micractinium conductrix]	KAF8061107.1 RDH14 [Scenedesmus sp. PABB004]
OG0002256	PSC67686.1 DUF887-domain-containing [Micractinium conductrix]	KAF8071225.1 SPAC17A2.02c [Scenedesmus sp. PABB004]
OG0002257	PSC69440.1 18S rRNA biogenesis RCL1_ partial [Micractinium conductrix]	KAF8072773.1 RCL1 [Scenedesmus sp. PABB004]
OG0002259	PSC74386.1 hypothetical protein C2E20_2402 [Micractinium conductrix], PSC75452.1 hypothetical protein C2E20_1601 [Micractinium conductrix], PSC75451.1 hypothetical protein C2E20_1601 [Micractinium conductrix]	KAF8072679.1 trim33 [Scenedesmus sp. PABB004]
OG0002261	PSC71816.1 nitrate reductase [Micractinium conductrix]	KAF8062729.1 hypothetical protein HT031_004059 [Scenedesmus sp. PABB004]
OG0002262	PSC75332.1 RAN GTPase-activating 1 [Micractinium conductrix]	KAF8069620.1 RANGAP1 [Scenedesmus sp. PABB004]
OG0002263	PSC76561.1 methyltransferase 7A [Micractinium conductrix]	KAF8072542.1 METTL7A [Scenedesmus sp. PABB004]
OG0002264	PSC72421.1 lysine-specific demethylase 5D isoform X1 [Micractinium conductrix]	KAF8065476.1 lysine-specific demethylase [Scenedesmus sp. PABB004]
OG0002265	PSC74158.1 Chlorophyll a-b binding CP29 [Micractinium conductrix]	KAF8058844.1 hypothetical protein HT031_005412 [Scenedesmus sp. PABB004], KAF8062918.1 Lhcb4 [Scenedesmus sp. PABB004]
OG0002267	PSC76698.1 hypothetical protein C2E20_0205 [Micractinium conductrix]	KAF8059385.1 NEK6 [Scenedesmus sp. PABB004]
OG0002268	PSC70701.1 metalloprotease [Micractinium conductrix]	KAF8059714.1 extracellular metalloprotease [Scenedesmus sp. PABB004], KAF8071238.1 MEP1 [Scenedesmus sp. PABB004]
