OG0000837	PSC69419.1 anaphase-promoting complex subunit 1 isoform X2 isoform C [Micractinium conductrix], PSC69420.1 anaphase-promoting complex subunit 1 isoform X2 isoform B [Micractinium conductrix], PSC69418.1 anaphase-promoting complex subunit 1 isoform X2 isoform D [Micractinium conductrix], PSC69417.1 anaphase-promoting complex subunit 1 isoform X2 isoform A [Micractinium conductrix]	KAF8066263.1 APC1 [Scenedesmus sp. PABB004]
OG0000838	PSC70531.1 nudC domain-containing 2 [Micractinium conductrix]	KAF8072502.1 ftsZ [Scenedesmus sp. PABB004]
OG0000840	PSC68220.1 hypothetical protein C2E20_8166 [Micractinium conductrix]	KAF8072477.1 RPH1 [Scenedesmus sp. PABB004]
OG0000841	PSC68929.1 histone deacetylase 15 isoform X1 [Micractinium conductrix]	KAF8054983.1 Hdac6 [Scenedesmus sp. PABB004]
OG0000842	PSC68643.1 thioredoxin peroxidase [Micractinium conductrix]	KAF8059218.1 THO5B [Scenedesmus sp. PABB004]
OG0000843	PSC70591.1 GDP-L-fucose synthase 2 [Micractinium conductrix]	KAF8055288.1 RHM1 [Scenedesmus sp. PABB004]
OG0000845	PSC75702.1 regulator of CO2-responsive genes isoform B [Micractinium conductrix], PSC75703.1 regulator of CO2-responsive genes isoform A [Micractinium conductrix]	KAF8059703.1 hypothetical protein HT031_005111 [Scenedesmus sp. PABB004], KAF8063720.1 hypothetical protein HT031_003575 [Scenedesmus sp. PABB004]
OG0000848	PSC71155.1 ferredoxin [Micractinium conductrix]	KAF8060297.1 hndD [Scenedesmus sp. PABB004]
OG0000848	PSC74930.1 NADH_ubiquinone oxidoreductase [Micractinium conductrix]	KAF8065822.1 hndD [Scenedesmus sp. PABB004]
OG0000850	PSC71061.1 P-loop containing nucleoside triphosphate hydrolases superfamily isoform 1 isoform A [Micractinium conductrix], PSC71060.1 P-loop containing nucleoside triphosphate hydrolases superfamily isoform 1 isoform B [Micractinium conductrix]	KAF8069434.1 peptidyl-Asp metalloendopeptidase [Scenedesmus sp. PABB004], KAF8071341.1 hypothetical protein HT031_001425 [Scenedesmus sp. PABB004]
OG0000851	PSC74838.1 glycosyl hydrolase [Micractinium conductrix], PSC76253.1 glycosyl hydrolase [Micractinium conductrix]	KAF8070963.1 mug157-like protein [Scenedesmus sp. PABB004]
OG0000852	PSC72863.1 Fibronectin type-III domain-containing 3a [Micractinium conductrix]	KAF8059974.1 FNDC3B [Scenedesmus sp. PABB004]
OG0000855	PSC75297.1 UPF0187_ chloroplastic [Micractinium conductrix], PSC73554.1 UPF0187 chloroplastic [Micractinium conductrix]	KAF8056864.1 hypothetical protein HT031_006208 [Scenedesmus sp. PABB004]
OG0000856	PSC73388.1 putative tRNA N6-adenosine threonylcarbamoyltransferase isoform A [Micractinium conductrix], PSC73389.1 putative tRNA N6-adenosine threonylcarbamoyltransferase isoform B [Micractinium conductrix]	KAF8058039.1 coiled-coil domain-containing protein [Scenedesmus sp. PABB004]
OG0000857	PSC72356.1 putative boron transporter 2 [Micractinium conductrix]	KAF8069590.1 BOR1 [Scenedesmus sp. PABB004]
OG0000858	PSC67126.1 mitochondrial inner membrane protease ATP23-like [Micractinium conductrix], PSC73865.1 mitochondrial inner membrane protease ATP23 [Micractinium conductrix], PSC67124.1 auxin efflux carrier family [Micractinium conductrix]	KAF8059713.1 PIP5K1 [Scenedesmus sp. PABB004]
OG0000860	PSC67991.1 S-adenosyl-L-methionine-dependent methyltransferase [Micractinium conductrix], PSC67978.1 lysine methyltransferase METTL21B [Micractinium conductrix]	KAF8056439.1 hypothetical protein HT031_006296 [Scenedesmus sp. PABB004]
OG0000864	PSC74727.1 SAM-dependent methyltransferase [Micractinium conductrix]	KAF8072614.1 methyltransferase [Scenedesmus sp. PABB004]
OG0000864	PSC69007.1 SAM-dependent methyltransferase [Micractinium conductrix]	KAF8058108.1 methyltransferase [Scenedesmus sp. PABB004]
OG0000865	PSC75977.1 putative beta-D-xylosidase 7 [Micractinium conductrix], PSC72215.1 putative beta-D-xylosidase 7 [Micractinium conductrix]	KAF8063677.1 BXL3 [Scenedesmus sp. PABB004]
OG0000869	PSC73449.1 hypothetical protein C2E20_3378 [Micractinium conductrix]	KAF8073165.1 hypothetical protein HT031_000826 [Scenedesmus sp. PABB004]
OG0000870	PSC75805.1 DEAD-box ATP-dependent RNA helicase 25-like [Micractinium conductrix]	KAF8057686.1 DEAD-box ATP-dependent RNA helicase 25 [Scenedesmus sp. PABB004]
OG0000878	PSC67394.1 hypothetical protein C2E20_8907 [Micractinium conductrix]	KAF8060576.1 trappc1-1 [Scenedesmus sp. PABB004]
OG0000879	PSC67615.1 glycoside hydrolase family 16 [Micractinium conductrix], PSC69716.1 Beta-glucan synthesis-associated SKN1 [Micractinium conductrix], PSC76523.1 Beta-glucan synthesis-associated SKN1 [Micractinium conductrix], PSC69753.1 glycoside hydrolase family 16 [Micractinium conductrix]	KAF8062056.1 KRE6 [Scenedesmus sp. PABB004]
OG0000881	PSC67667.1 nuclease [Micractinium conductrix]	KAF8061374.1 hypothetical protein HT031_004465 [Scenedesmus sp. PABB004], KAF8066261.1 HOL3 [Scenedesmus sp. PABB004]
OG0000882	PSC74364.1 flap endonuclease 1 [Micractinium conductrix]	KAF8060038.1 serine/threonine-protein kinase [Scenedesmus sp. PABB004], KAF8066374.1 fyna [Scenedesmus sp. PABB004], KAF8069589.1 FEN1 [Scenedesmus sp. PABB004]
OG0000884	PSC74772.1 mitochondrial sodium hydrogen exchanger 9B2-like [Micractinium conductrix], PSC74458.1 chitin deacetylase-like isoform e [Micractinium conductrix]	KAF8064624.1 CAT1 [Scenedesmus sp. PABB004]
OG0000885	PSC69812.1 AAA+-type ATPase _ISS_ [Micractinium conductrix], PSC71769.1 AAA+-type ATPase _ISS_ [Micractinium conductrix]	KAF8073061.1 hypothetical protein HT031_000722 [Scenedesmus sp. PABB004]
OG0000886	PSC67788.1 putative lumenal polypeptide [Micractinium conductrix], PSC68611.1 hypothetical protein C2E20_7784 [Micractinium conductrix]	KAF8072940.1 hypothetical protein HT031_000600 [Scenedesmus sp. PABB004]
OG0000888	PSC76793.1 alpha beta hydrolase domain-containing 11 [Micractinium conductrix], PSC73654.1 histone-lysine N-methyltransferase SUVR3 [Micractinium conductrix], PSC68281.1 hypothetical protein C2E20_8150_ partial [Micractinium conductrix]	KAF8062097.1 SUVR3 [Scenedesmus sp. PABB004]
OG0000890	PSC69547.1 5-oxoprolinase isoform B [Micractinium conductrix], PSC69546.1 5-oxoprolinase isoform A [Micractinium conductrix], PSC69545.1 5-oxoprolinase isoform C [Micractinium conductrix], PSC69544.1 5-oxoprolinase isoform D [Micractinium conductrix]	KAF8057728.1 hypothetical protein HT031_005912 [Scenedesmus sp. PABB004]
OG0000891	PSC74065.1 Rubisco activase [Micractinium conductrix]	KAF8061070.1 Ribulose bisphosphate carboxylase/oxygenase activase [Scenedesmus sp. PABB004], KAF8065664.1 hypothetical protein HT031_003265 [Scenedesmus sp. PABB004]
OG0000892	PSC70754.1 glycoside hydrolase [Micractinium conductrix]	KAF8064504.1 Beta-galactosidase [Scenedesmus sp. PABB004]
OG0000893	PSC70787.1 cobalamin biosynthesis [Micractinium conductrix]	KAF8062938.1 yeiR [Scenedesmus sp. PABB004]
OG0000895	PSC77049.1 phosphatidylglycerol phosphatidylinositol transfer [Micractinium conductrix]	KAF8069539.1 npc-2 [Scenedesmus sp. PABB004]
OG0000896	PSC70727.1 nitrate ABC transporter substrate-binding [Micractinium conductrix]	KAF8061945.1 hypothetical protein HT031_004205 [Scenedesmus sp. PABB004]
OG0000896	PSC70826.1 Mannose-P-dolichol utilization defect 1 [Micractinium conductrix]	KAF8061992.1 Mpdu1 [Scenedesmus sp. PABB004]
OG0000897	PSC74816.1 D-3-phosphoglycerate dehydrogenase family [Micractinium conductrix]	KAF8072973.1 PGDH1 [Scenedesmus sp. PABB004]
OG0000898	PSC72964.1 N-acetyltransferase 10 isoform A [Micractinium conductrix], PSC72965.1 N-acetyltransferase 10 isoform B [Micractinium conductrix]	KAF8064535.1 RNA cytidine acetyltransferase 1 [Scenedesmus sp. PABB004]
OG0000899	PSC74602.1 Eukaryotic translation initiation factor 3 subunit C [Micractinium conductrix]	KAF8068261.1 TIF3C1 [Scenedesmus sp. PABB004]
OG0000900	PSC75585.1 eukaryotic translation initiation factor 5A-2 [Micractinium conductrix]	KAF8072478.1 Eukaryotic translation initiation factor 5A-3 [Scenedesmus sp. PABB004]
OG0000901	PSC68416.1 SUMO-conjugating enzyme SCE1 [Micractinium conductrix]	KAF8057931.1 SCE1 [Scenedesmus sp. PABB004]
OG0000902	PSC76615.1 Serine protease ABC transporter B family tagA isoform A [Micractinium conductrix], PSC76614.1 Serine protease ABC transporter B family tagA isoform B [Micractinium conductrix]	KAF8071088.1 tagC [Scenedesmus sp. PABB004]
OG0000903	PSC75462.1 adenylate kinase [Micractinium conductrix]	KAF8062648.1 hypothetical protein HT031_003977 [Scenedesmus sp. PABB004]
OG0000904	PSC68680.1 Magnesium transporter [Micractinium conductrix], PSC72981.1 acetyltransferase NSI [Micractinium conductrix]	KAF8060564.1 SNAT2 [Scenedesmus sp. PABB004]
OG0000905	PSC73556.1 ERD4-related membrane [Micractinium conductrix], PSC75581.1 battenin [Micractinium conductrix]	KAF8068373.1 NAA25 [Scenedesmus sp. PABB004]
OG0000907	PSC76570.1 magnesium-chelatase subunit chloroplastic [Micractinium conductrix]	KAF8066364.1 hypothetical protein HT031_002688 [Scenedesmus sp. PABB004]
OG0000908	PSC71768.1 Iron-sulfur assembly -like mitochondrial [Micractinium conductrix], PSC69380.1 3-hydroxyacyl-dehydrogenase [Micractinium conductrix], PSC71748.1 inactive serine protease 54 isoform X2 [Micractinium conductrix]	KAF8062805.1 IscA-like protein [Scenedesmus sp. PABB004]
OG0000912	PSC67604.1 DNA ligase 4 isoform B [Micractinium conductrix], PSC67603.1 DNA ligase 4 isoform A [Micractinium conductrix]	KAF8065480.1 LIG4 [Scenedesmus sp. PABB004]
OG0000913	PSC71627.1 heterogeneous nuclear ribonucleo 1-like [Micractinium conductrix]	KAF8061320.1 RNP1 [Scenedesmus sp. PABB004]
OG0000914	PSC69187.1 Cytochrome c554 [Micractinium conductrix]	KAF8066269.1 hypothetical protein HT031_002592 [Scenedesmus sp. PABB004]
OG0000915	PSC68813.1 putative acyl-activating enzyme chloroplastic [Micractinium conductrix], PSC74557.1 long-chain-fatty-acid-ligase [Micractinium conductrix]	KAF8056477.1 AAE15 [Scenedesmus sp. PABB004]
OG0000916	PSC71366.1 EFR3-like protein B-like isoform X2 [Micractinium conductrix]	KAF8070940.1 GATA1 [Scenedesmus sp. PABB004]
OG0000917	PSC73917.1 RNA-binding NOB1 [Micractinium conductrix]	KAF8067249.1 fetC [Scenedesmus sp. PABB004], KAF8061145.1 fetC [Scenedesmus sp. PABB004], KAF8065842.1 NOB1 [Scenedesmus sp. PABB004]
OG0000919	PSC69491.1 Magnesium transporter MRS2-4 [Micractinium conductrix], PSC69475.1 Magnesium transporter MRS2-4 [Micractinium conductrix], PSC69394.1 Magnesium transporter MRS2-4 [Micractinium conductrix]	KAF8060603.1 MRS2-G [Scenedesmus sp. PABB004]
OG0000921	PSC68240.1 epimerase [Micractinium conductrix]	KAF8068154.1 hypothetical protein HT031_001840 [Scenedesmus sp. PABB004]
OG0000923	PSC74471.1 transmembrane 64-like [Micractinium conductrix], PSC68097.1 CRT _chloroquine-resistance transporter_-like transporter [Micractinium conductrix]	KAF8060581.1 TVP38/TMEM64 family protein [Scenedesmus sp. PABB004]
OG0000924	PSC70457.1 50S ribosomal L23 [Micractinium conductrix]	KAF8066392.1 ATG16 [Scenedesmus sp. PABB004]
OG0000925	PSC73212.1 iron manganese superoxide alpha-hairpin domain [Micractinium conductrix], PSC71348.1 hypothetical protein C2E20_5234 [Micractinium conductrix], PSC73153.1 N-acetylgalactosamine kinase [Micractinium conductrix], PSC73526.1 hypothetical protein C2E20_3519 [Micractinium conductrix]	KAF8064602.1 hypothetical protein HT031_003403 [Scenedesmus sp. PABB004]
OG0000926	PSC74335.1 microtubule organizing mora [Micractinium conductrix], PSC67998.1 microtubule associated [Micractinium conductrix]	KAF8062786.1 CKAP5 [Scenedesmus sp. PABB004]
OG0000927	PSC74701.1 Adenosine deaminase [Micractinium conductrix], PSC75895.1 B Chain Kynurenine Aminotransferase Ii Inhibitor [Micractinium conductrix]	KAF8065776.1 Aadat [Scenedesmus sp. PABB004]
OG0000928	PSC67473.1 hypothetical protein C2E20_8862 [Micractinium conductrix]	KAF8070962.1 acyl-lipid _7-3_-desaturase [Scenedesmus sp. PABB004]
OG0000928	PSC67453.1 hypothetical protein C2E20_8861 [Micractinium conductrix], PSC70948.1 inoleoyl-desaturase [Micractinium conductrix]	KAF8057774.1 acyl-lipid _7-3_-desaturase [Scenedesmus sp. PABB004]
OG0000929	PSC76996.1 G-strand telomere binding 1 [Micractinium conductrix]	KAF8065826.1 haloacid dehalogenase-like protein [Scenedesmus sp. PABB004]
OG0000933	PSC74935.1 RAP domain [Micractinium conductrix]	KAF8065534.1 hypothetical protein HT031_003135 [Scenedesmus sp. PABB004]
OG0000934	PSC71384.1 glycosyltransferase family 2 [Micractinium conductrix]	KAF8057137.1 CSLA3 [Scenedesmus sp. PABB004]
OG0000935	PSC70428.1 Deoxycytidylate deaminase [Micractinium conductrix]	KAF8072438.1 hypothetical protein HT031_000097 [Scenedesmus sp. PABB004]
OG0000936	PSC75411.1 hypothetical protein C2E20_1400 isoform X1 [Micractinium conductrix]	KAF8059185.1 TCAF2 [Scenedesmus sp. PABB004]
OG0000937	PSC70393.1 Leukotriene A-4 hydrolase isoform B [Micractinium conductrix], PSC70392.1 Leukotriene A-4 hydrolase isoform A [Micractinium conductrix]	KAF8069679.1 lkhA [Scenedesmus sp. PABB004]
OG0000938	PSC68701.1 Synaptosomal-associated 25 isoform B [Micractinium conductrix], PSC68702.1 Synaptosomal-associated 25 isoform A [Micractinium conductrix]	KAF8072599.1 SNAP33 [Scenedesmus sp. PABB004]
OG0000939	PSC67120.1 gamma-glutamyltranspeptidase 1-like [Micractinium conductrix]	KAF8065580.1 GGT2 [Scenedesmus sp. PABB004]
OG0000943	PSC71593.1 tubulin-folding cofactor D [Micractinium conductrix]	KAF8065491.1 hypothetical protein HT031_003092 [Scenedesmus sp. PABB004]
OG0000944	PSC76543.1 mitochondrial carrier [Micractinium conductrix]	KAF8055117.1 hypothetical protein HT031_006826 [Scenedesmus sp. PABB004]
OG0000945	PSC74354.1 short-chain dehydrogenase reductase [Micractinium conductrix], PSC74611.1 Telomerase-binding EST1A [Micractinium conductrix]	KAF8059717.1 hypothetical protein HT031_005125 [Scenedesmus sp. PABB004]
OG0000946	PSC74613.1 arylesterase isoform A [Micractinium conductrix], PSC74612.1 arylesterase isoform C [Micractinium conductrix], PSC74614.1 arylesterase isoform B [Micractinium conductrix]	KAF8065825.1 ydjP [Scenedesmus sp. PABB004]
OG0000947	PSC76913.1 kinase family [Micractinium conductrix]	KAF8058309.1 SIS8 [Scenedesmus sp. PABB004]
OG0000948	PSC71199.1 omega-3 fatty acid desaturase [Micractinium conductrix]	KAF8072958.1 FAD7 [Scenedesmus sp. PABB004], KAF8065821.1 FAD7 [Scenedesmus sp. PABB004], KAF8060338.1 FAD7 [Scenedesmus sp. PABB004]
OG0000950	PSC69053.1 beta-galactosidase [Micractinium conductrix]	KAF8055491.1 lacZ [Scenedesmus sp. PABB004]
OG0000951	PSC67896.1 hypothetical protein C2E20_8437 [Micractinium conductrix], PSC70225.1 heat shock factor HSF8 [Micractinium conductrix]	KAF8072933.1 HSFA1A [Scenedesmus sp. PABB004]
OG0000952	PSC75378.1 R-SNARE VAMP72-family [Micractinium conductrix]	KAF8061299.1 VAMP726 [Scenedesmus sp. PABB004]
OG0000953	PSC72680.1 COP9 signalosome complex subunit 2 [Micractinium conductrix]	KAF8072948.1 CSN2 [Scenedesmus sp. PABB004]
OG0000955	PSC67153.1 coproporphyrinogen III oxidase [Micractinium conductrix], PSC73612.1 coproporphyrinogen III oxidase chloroplast precursor [Micractinium conductrix]	KAF8061930.1 CPX1 [Scenedesmus sp. PABB004]
OG0000957	PSC73906.1 Alkaline phosphatase [Micractinium conductrix], PSC71808.1 peptidase S8 [Micractinium conductrix], PSC76857.1 subtilisin-like serine protease [Micractinium conductrix], PSC73967.1 hypothetical protein C2E20_2707 [Micractinium conductrix]	KAF8055404.1 hypothetical protein HT031_006772 [Scenedesmus sp. PABB004], KAF8054729.1 hypothetical protein HT031_006952 [Scenedesmus sp. PABB004]
OG0000958	PSC72292.1 Yippee zincbinding [Micractinium conductrix]	KAF8072466.1 ypel3 [Scenedesmus sp. PABB004]
OG0000959	PSC72095.1 outer dynein arm-docking complex subunit 3 isoform A [Micractinium conductrix], PSC72096.1 outer dynein arm-docking complex subunit 3 isoform B [Micractinium conductrix]	KAF8055671.1 CMD1 [Scenedesmus sp. PABB004]
OG0000961	PSC72473.1 hypothetical protein C2E20_4277 [Micractinium conductrix]	KAF8068184.1 Polr3e [Scenedesmus sp. PABB004]
OG0000962	PSC70538.1 GDP-fucose synthetase [Micractinium conductrix], PSC70540.1 GDP-L-fucose synthase 2 [Micractinium conductrix], PSC72484.1 ABC transporter F family member 4 isoform A [Micractinium conductrix], PSC72485.1 ABC transporter F family member 4 isoform B [Micractinium conductrix]	KAF8072920.1 ABCF4 [Scenedesmus sp. PABB004]
OG0000966	PSC68745.1 methyltransferase TARBP1 [Micractinium conductrix], PSC68746.1 hypothetical protein C2E20_7628 [Micractinium conductrix]	KAF8072749.1 TARBP1 [Scenedesmus sp. PABB004]
OG0000967	PSC67968.1 flavin-containing monooxygenase FMO GS-OX-like 4 isoform A [Micractinium conductrix], PSC67969.1 flavin-containing monooxygenase FMO GS-OX-like 4 isoform B [Micractinium conductrix], PSC67970.1 flavin-containing monooxygenase FMO GS-OX-like 4 isoform C [Micractinium conductrix]	KAF8055472.1 FMO GS-OX-like 3 [Scenedesmus sp. PABB004], KAF8068234.1 flavin-containing monooxygenase [Scenedesmus sp. PABB004]
OG0000968	PSC74486.1 ATP-dependent DNA helicase Q-like 1 [Micractinium conductrix]	KAF8057261.1 RECQL1 [Scenedesmus sp. PABB004]
OG0000969	PSC72630.1 phagocytic receptor 1b [Micractinium conductrix]	KAF8058061.1 TMN3 [Scenedesmus sp. PABB004]
OG0000971	PSC74845.1 MAP3K epsilon kinase 1-like [Micractinium conductrix]	KAF8067403.1 M3KE1 [Scenedesmus sp. PABB004]
OG0000972	PSC71939.1 NADH dehydrogenase [ubiquinone] flavo mitochondrial [Micractinium conductrix]	KAF8054894.1 NADH dehydrogenase [ubiquinone] flavoprotein 1 [Scenedesmus sp. PABB004]
OG0000973	PSC67539.1 manganese resistance 1 [Micractinium conductrix], PSC71917.1 calcium proton exchanger [Micractinium conductrix]	KAF8071234.1 VCX1 [Scenedesmus sp. PABB004]
OG0000974	PSC71864.1 DEAD-box ATP-dependent RNA helicase 37-like [Micractinium conductrix]	KAF8063857.1 PL10B [Scenedesmus sp. PABB004]
OG0000975	PSC67138.1 long-chain acyl-synthetase 7_ partial [Micractinium conductrix], PSC69107.1 Long chain acyl-synthetase peroxisomal [Micractinium conductrix]	KAF8056826.1 LACS7 [Scenedesmus sp. PABB004], KAF8073206.1 LACS7 [Scenedesmus sp. PABB004]
OG0000976	PSC67312.1 TPR domain [Micractinium conductrix], PSC69236.1 sulfotransferase [Micractinium conductrix]	KAF8066334.1 hypothetical protein HT031_002657 [Scenedesmus sp. PABB004]
OG0000977	PSC73593.1 disulfide-isomerase 5-4 [Micractinium conductrix]	KAF8059386.1 PDIL5-4 [Scenedesmus sp. PABB004], KAF8059388.1 hypothetical protein HT031_005193 [Scenedesmus sp. PABB004], KAF8059387.1 sulfatase [Scenedesmus sp. PABB004], KAF8062775.1 PDIL5-4 [Scenedesmus sp. PABB004]
OG0000978	PSC73683.1 zinc finger CCCH domain-containing 40 [Micractinium conductrix]	KAF8060585.1 zinc finger CCCH domain-containing protein 40 [Scenedesmus sp. PABB004]
OG0000979	PSC68901.1 Amino acid kinase family isoform 1 [Micractinium conductrix]	KAF8060512.1 hypothetical protein HT031_004688 [Scenedesmus sp. PABB004]
OG0000981	PSC73940.1 putative magnesium transporter NIPA8 [Micractinium conductrix]	KAF8062948.1 hypothetical protein HT031_003787 [Scenedesmus sp. PABB004]
OG0000982	PSC69918.1 CWF19 2 [Micractinium conductrix]	KAF8070946.1 MFSD14A [Scenedesmus sp. PABB004]
OG0000983	PSC67997.1 FAD-dependent oxidoreductase [Micractinium conductrix]	KAF8063792.1 thiO [Scenedesmus sp. PABB004]
OG0000984	PSC75718.1 myosin heavy class XI [Micractinium conductrix]	KAF8071387.1 XI-I [Scenedesmus sp. PABB004], KAF8063028.1 XI-F [Scenedesmus sp. PABB004]
OG0000985	PSC72636.1 serine threonine-phosphatase 7 [Micractinium conductrix], PSC75899.1 Serine threonine-phosphatase 7 [Micractinium conductrix]	KAF8068462.1 PP7 [Scenedesmus sp. PABB004]
OG0000986	PSC74575.1 5 -C-terminal domain-containing [Micractinium conductrix], PSC76623.1 Trifunctional nucleotide phosphoesterase [Micractinium conductrix]	KAF8064656.1 yfkN [Scenedesmus sp. PABB004]
OG0000987	PSC71166.1 Hsp100 family [Micractinium conductrix]	KAF8065731.1 CLPB3 [Scenedesmus sp. PABB004]
OG0000992	PSC68498.1 CBS domain-containing mitochondrial-like [Micractinium conductrix]	KAF8058331.1 CBSX3 [Scenedesmus sp. PABB004]
OG0000993	PSC73912.1 Argininosuccinate synthase [Micractinium conductrix]	KAF8061888.1 DAW1 [Scenedesmus sp. PABB004]
OG0000994	PSC76770.1 putative lactoylglutathione chloroplast isoform A [Micractinium conductrix], PSC76769.1 putative lactoylglutathione chloroplast isoform B [Micractinium conductrix], PSC75265.1 triple functional domain [Micractinium conductrix], PSC75425.1 Single-minded 1 [Micractinium conductrix]	KAF8056006.1 lactoylglutathione lyase [Scenedesmus sp. PABB004]
OG0000996	PSC76194.1 hypothetical protein C2E20_0127 [Micractinium conductrix]	KAF8066162.1 hypothetical protein HT031_002484 [Scenedesmus sp. PABB004]
OG0000998	PSC72772.1 threonylcarbamoyladenosine tRNA methylthiotransferase [Micractinium conductrix]	KAF8069534.1 cdkal1 [Scenedesmus sp. PABB004], KAF8072556.1 Glycosyltransferase-like protein [Scenedesmus sp. PABB004]
OG0000999	PSC74268.1 DNA replication complex GINS PSF1 [Micractinium conductrix], PSC72601.1 MFS transporter [Micractinium conductrix]	KAF8056779.1 hypothetical protein HT031_006277 [Scenedesmus sp. PABB004]
OG0001001	PSC68017.1 peptidase M20 [Micractinium conductrix], PSC74630.1 adenine guanine permease AZG1 [Micractinium conductrix]	KAF8071270.1 AZG1 [Scenedesmus sp. PABB004]
OG0001003	PSC74959.1 putative trehalase [Micractinium conductrix], PSC73401.1 putative trehalase [Micractinium conductrix]	KAF8067132.1 trehalase [Scenedesmus sp. PABB004]
OG0001004	PSC76494.1 dual specificity phosphatase 1-like isoform B [Micractinium conductrix], PSC76495.1 dual specificity phosphatase 1-like isoform A [Micractinium conductrix]	KAF8069586.1 VH-PTP13 [Scenedesmus sp. PABB004]
OG0001006	PSC72554.1 glyoxysomal fatty acid beta-oxidation multifunctional MFP-a [Micractinium conductrix], PSC72504.1 chitobiosyldiphosphodolichol beta-mannosyltransferase-like [Micractinium conductrix]	KAF8068308.1 hypothetical protein HT031_001995 [Scenedesmus sp. PABB004]
OG0001007	PSC70617.1 casein kinase II subunit alpha [Micractinium conductrix]	KAF8067406.1 cka1 [Scenedesmus sp. PABB004], KAF8055584.1 HD6 [Scenedesmus sp. PABB004]
OG0001010	PSC73988.1 UDP-glucose dehydrogenase [Micractinium conductrix], PSC76863.1 UDP-glucose dehydrogenase [Micractinium conductrix]	KAF8073109.1 UGD1 [Scenedesmus sp. PABB004]
OG0001011	PSC67739.1 IAA-amino acid hydrolase ILR1-like 3 [Micractinium conductrix], PSC69535.1 IAA-amino acid hydrolase ILR1-like 4 [Micractinium conductrix], PSC75002.1 peptidase M20 [Micractinium conductrix]	KAF8058874.1 ILL5 [Scenedesmus sp. PABB004]
OG0001012	PSC70317.1 Protease 2 [Micractinium conductrix]	KAF8063007.1 dapb1 [Scenedesmus sp. PABB004]
OG0001013	PSC68627.1 GTP-binding protein isoform B [Micractinium conductrix], PSC68628.1 GTP-binding protein isoform A [Micractinium conductrix]	KAF8073164.1 GTP-binding protein [Scenedesmus sp. PABB004]
OG0001014	PSC75577.1 hypothetical protein C2E20_1509 [Micractinium conductrix]	KAF8057153.1 CPK2 [Scenedesmus sp. PABB004]
OG0001015	PSC67834.1 hypothetical protein C2E20_8516 [Micractinium conductrix]	KAF8065818.1 tun [Scenedesmus sp. PABB004]
OG0001019	PSC72999.1 p-type h+-atpase isoform D [Micractinium conductrix], PSC73001.1 p-type h+-atpase isoform B [Micractinium conductrix], PSC73002.1 p-type h+-atpase isoform C [Micractinium conductrix], PSC73000.1 p-type h+-atpase isoform A [Micractinium conductrix]	KAF8071323.1 H1A [Scenedesmus sp. PABB004], KAF8061970.1 H1B [Scenedesmus sp. PABB004]
OG0001021	PSC69480.1 major facilitator transporter [Micractinium conductrix], PSC69550.1 glyceraldehyde-3-phosphate dehydrogenase [Micractinium conductrix]	KAF8068320.1 gap3 [Scenedesmus sp. PABB004], KAF8068316.1 gap3 [Scenedesmus sp. PABB004]
OG0001022	PSC71919.1 Carotenoid cleavage dioxygenase 8 isoform A [Micractinium conductrix], PSC71918.1 Carotenoid cleavage dioxygenase 8 isoform B [Micractinium conductrix], PSC71885.1 carotenoid oxygenase [Micractinium conductrix], PSC71910.1 Carotenoid cleavage dioxygenase 8 [Micractinium conductrix]	KAF8072879.1 CCD8B [Scenedesmus sp. PABB004]
OG0001023	PSC69817.1 phosphoglycerate mutase [Micractinium conductrix], PSC69919.1 phosphoglycerate mutase [Micractinium conductrix]	KAF8054608.1 phosphoglycerate mutase-like protein [Scenedesmus sp. PABB004], KAF8067106.1 phosphoglycerate mutase-like protein [Scenedesmus sp. PABB004]
OG0001024	PSC70881.1 MARVEL-like domain [Micractinium conductrix]	KAF8065806.1 Fbxo31 [Scenedesmus sp. PABB004]
OG0001025	PSC71641.1 putative calcium-binding CML21 [Micractinium conductrix]	KAF8055278.1 CML21 [Scenedesmus sp. PABB004]
OG0001026	PSC74866.1 cyclopropane-fatty-acyl-phospholipid synthase [Micractinium conductrix], PSC70669.1 trichothecene 3-O-acetyltransferase [Micractinium conductrix], PSC75304.1 citrate transporter [Micractinium conductrix]	KAF8055090.1 OCA2 [Scenedesmus sp. PABB004]
OG0001028	PSC75020.1 methionine-R-sulfoxide reductase [Micractinium conductrix]	KAF8067171.1 msrB [Scenedesmus sp. PABB004]
OG0001028	PSC72670.1 methionine sulfoxide reductase B [Micractinium conductrix]	KAF8071050.1 MSRB2 [Scenedesmus sp. PABB004]
OG0001029	PSC76009.1 cytidyltransferase-related domain [Micractinium conductrix]	KAF8065565.1 Wdr78 [Scenedesmus sp. PABB004]
OG0001030	PSC74978.1 kelch 8 [Micractinium conductrix]	KAF8064617.1 Klhl12 [Scenedesmus sp. PABB004]
OG0001031	PSC70008.1 Equilibrative nucleoside transporter 4 [Micractinium conductrix], PSC75325.1 Equilibrative nucleoside transporter 4 [Micractinium conductrix], PSC75565.1 Equilibrative nucleoside transporter 4 [Micractinium conductrix], PSC75682.1 Equilibrative nucleoside transporter 4 [Micractinium conductrix]	KAF8055275.1 ENT6 [Scenedesmus sp. PABB004], KAF8069407.1 ETN8 [Scenedesmus sp. PABB004]
OG0001032	PSC70175.1 zinc finger with UFM1-specific peptidase domain [Micractinium conductrix]	KAF8062748.1 hypothetical protein HT031_004078 [Scenedesmus sp. PABB004]
