OG0003479	PSC74376.1 ribokinase [Micractinium conductrix]	KAF8073119.1 hypothetical protein HT031_000780 [Scenedesmus sp. PABB004]
OG0003482	PSC73196.1 DNA polymerase delta subunit 4 [Micractinium conductrix]	KAF8060615.1 POLD4 [Scenedesmus sp. PABB004]
OG0003483	PSC69316.1 NTP pyrophosphohydrolase [Micractinium conductrix]	KAF8057732.1 mutT [Scenedesmus sp. PABB004]
OG0003485	PSC68848.1 thiazole biosynthetic enzyme [Micractinium conductrix]	KAF8055735.1 THI1 [Scenedesmus sp. PABB004]
OG0003486	PSC74873.1 cell division control 48-like protein B [Micractinium conductrix]	KAF8069587.1 CDC48B [Scenedesmus sp. PABB004]
OG0003487	PSC75974.1 39S ribosomal mitochondrial [Micractinium conductrix]	KAF8072924.1 mapkbp1 [Scenedesmus sp. PABB004]
OG0003488	PSC74927.1 unc-50-like protein [Micractinium conductrix]	KAF8058438.1 unc-50-like protein [Scenedesmus sp. PABB004]
OG0003489	PSC68346.1 U6 snRNA-associated Sm LSm2 [Micractinium conductrix]	KAF8065934.1 LSM2 [Scenedesmus sp. PABB004]
OG0003491	PSC68714.1 hypothetical protein C2E20_7748 [Micractinium conductrix]	KAF8073179.1 hypothetical protein HT031_000840 [Scenedesmus sp. PABB004]
OG0003493	PSC67326.1 WD repeat-containing 11-like [Micractinium conductrix]	KAF8072780.1 hypothetical protein HT031_000440 [Scenedesmus sp. PABB004]
OG0003494	PSC76191.1 putative hydrolase -like isoform A [Micractinium conductrix], PSC76190.1 putative hydrolase -like isoform B [Micractinium conductrix]	KAF8067432.1 hypothetical protein HT031_002480 [Scenedesmus sp. PABB004]
OG0003496	PSC75754.1 low CO2-induced [Micractinium conductrix]	KAF8061357.1 FAD4 [Scenedesmus sp. PABB004]
OG0003497	PSC68207.1 chloroplast precursor [Micractinium conductrix]	KAF8073050.1 FDC2 [Scenedesmus sp. PABB004]
OG0003498	PSC75281.1 transcription factor DPB [Micractinium conductrix]	KAF8071158.1 hypothetical protein HT031_001240 [Scenedesmus sp. PABB004]
OG0003501	PSC71140.1 Methionyl-tRNA formyltransferase [Micractinium conductrix]	KAF8057719.1 fmt [Scenedesmus sp. PABB004]
OG0003504	PSC68330.1 DNA-directed primase polymerase [Micractinium conductrix]	KAF8071335.1 primpol [Scenedesmus sp. PABB004]
OG0003505	PSC75807.1 hypothetical protein C2E20_1467 [Micractinium conductrix]	KAF8055918.1 ESR2 [Scenedesmus sp. PABB004]
OG0003509	PSC68364.1 trafficking particle complex subunit 2-like [Micractinium conductrix]	KAF8059170.1 Trappc2 [Scenedesmus sp. PABB004]
OG0003510	PSC75822.1 Peptidyl-prolyl cis-trans isomerase D [Micractinium conductrix]	KAF8070900.1 hypothetical protein HT031_000981 [Scenedesmus sp. PABB004]
OG0003511	PSC68316.1 Sorting nexin-12 [Micractinium conductrix]	KAF8061298.1 hypothetical protein HT031_004389 [Scenedesmus sp. PABB004]
OG0003512	PSC75082.1 cytochrome P450 superfamily [Micractinium conductrix]	KAF8056787.1 CYP97A3 [Scenedesmus sp. PABB004]
OG0003514	PSC71193.1 zinc finger family [Micractinium conductrix]	KAF8071294.1 hypothetical protein HT031_001377 [Scenedesmus sp. PABB004]
OG0003515	PSC71177.1 S-formylglutathione hydrolase [Micractinium conductrix]	KAF8056221.1 hypothetical protein HT031_006409 [Scenedesmus sp. PABB004]
OG0003516	PSC75583.1 2_ 5 -phosphodiesterase 12 [Micractinium conductrix]	KAF8065445.1 CSTF77 [Scenedesmus sp. PABB004]
OG0003517	PSC70492.1 WD40 repeat [Micractinium conductrix]	KAF8071219.1 UTP4 [Scenedesmus sp. PABB004]
OG0003518	PSC72761.1 glutathione S-transferase [Micractinium conductrix]	KAF8065797.1 yqjG [Scenedesmus sp. PABB004]
OG0003520	PSC74370.1 30S ribosomal S1 [Micractinium conductrix]	KAF8067386.1 RPS1 [Scenedesmus sp. PABB004]
OG0003521	PSC71941.1 DEAD-box ATP-dependent RNA helicase 39 [Micractinium conductrix]	KAF8072921.1 DEAD-box ATP-dependent RNA helicase 39 [Scenedesmus sp. PABB004]
OG0003522	PSC73261.1 acetyl-cytosolic 2 [Micractinium conductrix]	KAF8072872.1 acetyl-CoA acetyltransferase [Scenedesmus sp. PABB004]
OG0003524	PSC70977.1 putative helicase MAGATAMA 3 [Micractinium conductrix]	KAF8069469.1 MAA3 [Scenedesmus sp. PABB004]
OG0003526	PSC75202.1 pyridoxal-5 -phosphate-dependent subunit beta [Micractinium conductrix], PSC75653.1 MAD2L1-binding [Micractinium conductrix]	KAF8063796.1 hypothetical protein HT031_003653 [Scenedesmus sp. PABB004]
OG0003527	PSC72713.1 initiator tRNA phosphoribosyl [Micractinium conductrix]	KAF8072819.1 hypothetical protein HT031_000479 [Scenedesmus sp. PABB004]
OG0003530	PSC73802.1 conserved oligomeric Golgi complex subunit 7-like [Micractinium conductrix]	KAF8056866.1 COG7 [Scenedesmus sp. PABB004]
OG0003531	PSC73576.1 cobalamin biosynthesis [Micractinium conductrix]	KAF8069532.1 JMJD7 [Scenedesmus sp. PABB004]
OG0003533	PSC72242.1 Eukaryotic translation initiation factor 3 subunit H [Micractinium conductrix]	KAF8058059.1 TIF3H1 [Scenedesmus sp. PABB004]
OG0003535	PSC76101.1 ER lumen -retaining receptor [Micractinium conductrix]	KAF8071308.1 ydcF [Scenedesmus sp. PABB004]
OG0003536	PSC76632.1 mitotic checkpoint [Micractinium conductrix]	KAF8061302.1 BUB3.2 [Scenedesmus sp. PABB004]
OG0003537	PSC73596.1 ATP adenylyltransferase [Micractinium conductrix]	KAF8071003.1 APA2 [Scenedesmus sp. PABB004]
OG0003541	PSC69216.1 ATP synthase subunit mitochondrial [Micractinium conductrix]	KAF8061291.1 ATP synthase subunit epsilon [Scenedesmus sp. PABB004]
OG0003542	PSC71278.1 cytochrome c oxidase assembly mitochondrial-like [Micractinium conductrix]	KAF8059201.1 COX11 [Scenedesmus sp. PABB004]
OG0003544	PSC75015.1 28S ribosomal mitochondrial [Micractinium conductrix]	KAF8070878.1 MRPS34 [Scenedesmus sp. PABB004]
OG0003546	PSC71323.1 ribosome biogenesis GTPase [Micractinium conductrix]	KAF8057737.1 DGP3 [Scenedesmus sp. PABB004]
OG0003548	PSC74961.1 Molybdenum cofactor sulfurase [Micractinium conductrix]	KAF8057669.1 hypothetical protein HT031_006018 [Scenedesmus sp. PABB004]
OG0003549	PSC74815.1 root UVB sensitive 5-like [Micractinium conductrix]	KAF8071172.1 RUS5 [Scenedesmus sp. PABB004]
OG0003550	PSC67569.1 hypothetical protein C2E20_8778 [Micractinium conductrix]	KAF8064643.1 EIF4E1 [Scenedesmus sp. PABB004]
OG0003551	PSC73605.1 hypothetical protein C2E20_2923 [Micractinium conductrix]	KAF8056432.1 hypothetical protein HT031_006289 [Scenedesmus sp. PABB004]
OG0003554	PSC68099.1 Acyltransferase chloroplastic [Micractinium conductrix]	KAF8068456.1 acyltransferase-like protein [Scenedesmus sp. PABB004]
OG0003555	PSC68095.1 Gem-associated 2 [Micractinium conductrix]	KAF8072849.1 Gemin2 [Scenedesmus sp. PABB004]
OG0003556	PSC67556.1 hypothetical protein C2E20_8783 [Micractinium conductrix]	KAF8056239.1 aarF domain-containing protein kinase [Scenedesmus sp. PABB004]
OG0003559	PSC70629.1 HAD-superfamily [Micractinium conductrix]	KAF8061355.1 DTX44 [Scenedesmus sp. PABB004]
OG0003560	PSC69621.1 ribosomal RNA small subunit methyltransferase I [Micractinium conductrix]	KAF8069672.1 rsmI [Scenedesmus sp. PABB004]
OG0003561	PSC70671.1 molecular chaperone [Micractinium conductrix]	KAF8061285.1 dnaJ [Scenedesmus sp. PABB004]
OG0003562	PSC74757.1 transcription initiation factor TFIID subunit 8 [Micractinium conductrix]	KAF8066291.1 Taf3 [Scenedesmus sp. PABB004]
OG0003565	PSC69515.1 ER membrane complex subunit 3-like [Micractinium conductrix]	KAF8061316.1 emc3 [Scenedesmus sp. PABB004]
OG0003566	PSC72336.1 DCN1 2 [Micractinium conductrix]	KAF8065504.1 Dcun1d1 [Scenedesmus sp. PABB004]
OG0003567	PSC69048.1 arsenical pump-driving ATPase [Micractinium conductrix]	KAF8054880.1 ARSA1 [Scenedesmus sp. PABB004]
OG0003570	PSC71571.1 glutamine synthetase [Micractinium conductrix]	KAF8057884.1 GLN1 [Scenedesmus sp. PABB004]
OG0003571	PSC73139.1 50S ribosomal chloroplastic-like [Micractinium conductrix]	KAF8072946.1 rplT [Scenedesmus sp. PABB004]
OG0003572	PSC73533.1 WD repeat-containing 48 [Micractinium conductrix]	KAF8066279.1 wdr48 [Scenedesmus sp. PABB004]
OG0003574	PSC72161.1 carbohydrate kinase [Micractinium conductrix]	KAF8062764.1 ribulose-phosphate 3-epimerase [Scenedesmus sp. PABB004]
OG0003575	PSC70794.1 Succinate dehydrogenase [ubiquinone] iron-sulfur mitochondrial [Micractinium conductrix]	KAF8057921.1 sdhb [Scenedesmus sp. PABB004]
OG0003576	PSC75314.1 TIMELESS-interacting [Micractinium conductrix]	KAF8069388.1 hypothetical protein HT031_001503 [Scenedesmus sp. PABB004]
OG0003577	PSC69505.1 flagellar associated [Micractinium conductrix], PSC69448.1 flagellar associated [Micractinium conductrix]	KAF8060598.1 hypothetical protein HT031_004775 [Scenedesmus sp. PABB004]
OG0003578	PSC75533.1 hypothetical protein C2E20_1361 [Micractinium conductrix]	KAF8071178.1 zinc finger CCCH domain-containing protein 23 [Scenedesmus sp. PABB004]
OG0003580	PSC70812.1 complex 1 family LVR family _ISS_ [Micractinium conductrix]	KAF8060016.1 hypothetical protein HT031_004954 [Scenedesmus sp. PABB004]
OG0003582	PSC74643.1 thioredoxin [Micractinium conductrix]	KAF8058131.1 Thioredoxin F-type [Scenedesmus sp. PABB004]
OG0003584	PSC74721.1 dihydrodipicolinate synthase [Micractinium conductrix]	KAF8065572.1 DHPS1 [Scenedesmus sp. PABB004]
OG0003586	PSC72699.1 putative pox protein [Micractinium conductrix]	KAF8056750.1 hypothetical protein HT031_006248 [Scenedesmus sp. PABB004]
OG0003588	PSC74655.1 abhydrolase domain-containing [Micractinium conductrix]	KAF8068445.1 extracellular metalloprotease [Scenedesmus sp. PABB004]
OG0003591	PSC74129.1 BRCT domain-containing isoform B [Micractinium conductrix], PSC74130.1 BRCT domain-containing isoform A [Micractinium conductrix]	KAF8062735.1 hypothetical protein HT031_004065 [Scenedesmus sp. PABB004]
OG0003594	PSC73436.1 Nucleic acid-OB-fold [Micractinium conductrix]	KAF8068209.1 hypothetical protein HT031_001895 [Scenedesmus sp. PABB004]
OG0003595	PSC68984.1 CBS domain [Micractinium conductrix]	KAF8071153.1 hypothetical protein HT031_001235 [Scenedesmus sp. PABB004]
OG0003596	PSC76096.1 cysteine-tRNA cytoplasmic isoform X1 [Micractinium conductrix]	KAF8072941.1 Cysteine--tRNA ligase [Scenedesmus sp. PABB004]
OG0003599	PSC67770.1 tyrosine decarboxylase 1-like [Micractinium conductrix]	KAF8067231.1 hypothetical protein HT031_002278 [Scenedesmus sp. PABB004]
OG0003600	PSC67512.1 vacuolar -sorting-associated 33-like protein [Micractinium conductrix]	KAF8069504.1 VPS33 [Scenedesmus sp. PABB004]
OG0003601	PSC68076.1 Trafficking particle complex subunit 6B [Micractinium conductrix]	KAF8063037.1 trappc6b [Scenedesmus sp. PABB004]
OG0003602	PSC69415.1 dihydrolipoyllysine-residue acetyltransferase component 1 of pyruvate dehydrogenase mitochondrial isoform X2 [Micractinium conductrix]	KAF8062077.1 LTA3 [Scenedesmus sp. PABB004]
OG0003603	PSC73269.1 tRNA _guanine_37_-N1_-methyltransferase 1 [Micractinium conductrix]	KAF8058040.1 tRNA _guanine_37_-N1_-methyltransferase [Scenedesmus sp. PABB004]
OG0003604	PSC70456.1 late embryogenesis abundant [Micractinium conductrix]	KAF8064647.1 hypothetical protein HT031_003448 [Scenedesmus sp. PABB004]
OG0003606	PSC73104.1 BTB POZ domain-containing protein isoform X2 [Micractinium conductrix]	KAF8070854.1 HPT1 [Scenedesmus sp. PABB004]
OG0003607	PSC68927.1 electron transfer flavo subunit beta [Micractinium conductrix]	KAF8056392.1 etfB [Scenedesmus sp. PABB004]
OG0003608	PSC69317.1 flagellar associated [Micractinium conductrix]	KAF8056454.1 hypothetical protein HT031_006311 [Scenedesmus sp. PABB004]
OG0003609	PSC70355.1 ATP synthase subunit alpha [Micractinium conductrix]	KAF8063752.1 atpA [Scenedesmus sp. PABB004]
OG0003610	PSC71977.1 U7 snRNA-associated Sm LSm11 [Micractinium conductrix]	KAF8066332.1 LSM11 [Scenedesmus sp. PABB004]
OG0003611	PSC70391.1 sm LSM7 [Micractinium conductrix]	KAF8067266.1 LSM7 [Scenedesmus sp. PABB004]
OG0003615	PSC75231.1 cytochrome b-c1 complex subunit 6-like [Micractinium conductrix]	KAF8063094.1 QCR6-1 [Scenedesmus sp. PABB004]
OG0003616	PSC69537.1 Photosystem II 10 kDa chloroplastic [Micractinium conductrix]	KAF8066186.1 hypothetical protein HT031_002508 [Scenedesmus sp. PABB004]
OG0003617	PSC75453.1 FAS-associated factor 2-B [Micractinium conductrix]	KAF8073204.1 PUX10 [Scenedesmus sp. PABB004]
OG0003618	PSC75990.1 2-oxoisovalerate dehydrogenase subunit alpha 2_ mitochondrial-like [Micractinium conductrix]	KAF8068400.1 2-oxoisovalerate dehydrogenase subunit alpha 2 [Scenedesmus sp. PABB004]
OG0003620	PSC67395.1 DNA-directed RNA polymerase III subunit RPC4 [Micractinium conductrix]	KAF8069483.1 hypothetical protein HT031_001599 [Scenedesmus sp. PABB004]
OG0003621	PSC70001.1 DIS3-like exonuclease 2 [Micractinium conductrix]	KAF8059172.1 hypothetical protein HT031_005344 [Scenedesmus sp. PABB004]
OG0003622	PSC69781.1 nifU chloroplastic [Micractinium conductrix]	KAF8069514.1 NIFU2 [Scenedesmus sp. PABB004]
OG0003624	PSC75827.1 hypothetical protein C2E20_1637 [Micractinium conductrix]	KAF8069402.1 Gemin5 [Scenedesmus sp. PABB004], KAF8056857.1 hypothetical protein HT031_006201 [Scenedesmus sp. PABB004]
OG0003626	PSC69713.1 CDP-diacylglycerol-glycerol-3-phosphate 3-phosphatidyltransferase [Micractinium conductrix]	KAF8068386.1 PGPS1 [Scenedesmus sp. PABB004]
OG0003628	PSC75373.1 F-box-like WD repeat-containing TBL1X [Micractinium conductrix]	KAF8073070.1 tbl1xr1-a [Scenedesmus sp. PABB004]
OG0003629	PSC74098.1 brefeldin A-inhibited guanine nucleotide-exchange 2-like [Micractinium conductrix]	KAF8064597.1 BIG3 [Scenedesmus sp. PABB004]
OG0003630	PSC70345.1 hypothetical protein C2E20_6105 [Micractinium conductrix]	KAF8072585.1 hypothetical protein HT031_000245 [Scenedesmus sp. PABB004]
OG0003631	PSC69779.1 SPT2-like protein [Micractinium conductrix]	KAF8069559.1 hypothetical protein HT031_001676 [Scenedesmus sp. PABB004]
OG0003632	PSC70768.1 saccharopine dehydrogenase-like oxidoreductase [Micractinium conductrix]	KAF8054984.1 Sccpdh [Scenedesmus sp. PABB004]
OG0003633	PSC71239.1 glucokinase [Micractinium conductrix]	KAF8057125.1 glk [Scenedesmus sp. PABB004]
OG0003634	PSC70764.1 malonyl-mitochondrial isoform B [Micractinium conductrix], PSC70765.1 malonyl-mitochondrial isoform A [Micractinium conductrix]	KAF8056435.1 hypothetical protein HT031_006292 [Scenedesmus sp. PABB004]
OG0003635	PSC71273.1 transcriptional coactivator p15 [Micractinium conductrix]	KAF8067183.1 SUB1 [Scenedesmus sp. PABB004]
OG0003636	PSC71079.1 putative vacuolar membrane [Micractinium conductrix]	KAF8068260.1 hypothetical protein HT031_001947 [Scenedesmus sp. PABB004]
OG0003637	PSC67414.1 Glucosidase 2 subunit beta [Micractinium conductrix]	KAF8065786.1 glucosidase 2 subunit beta [Scenedesmus sp. PABB004]
OG0003639	PSC70926.1 RNA-binding 42-like isoform X1 [Micractinium conductrix]	KAF8055091.1 rbm42 [Scenedesmus sp. PABB004]
OG0003641	PSC71390.1 ribosomal RNA-processing 7 [Micractinium conductrix]	KAF8072922.1 Rrp7a [Scenedesmus sp. PABB004]
OG0003644	PSC73075.1 ubiquitin receptor RAD23b-like [Micractinium conductrix]	KAF8056132.1 RAD23B [Scenedesmus sp. PABB004]
OG0003645	PSC70884.1 OTU domain-containing 6B [Micractinium conductrix]	KAF8065793.1 OTU5 [Scenedesmus sp. PABB004]
OG0003646	PSC72991.1 putative cadmium zinc-transporting ATPase chloroplastic [Micractinium conductrix]	KAF8062959.1 HMA1 [Scenedesmus sp. PABB004]
OG0003647	PSC69517.1 hypothetical protein C2E20_7044 [Micractinium conductrix], PSC69518.1 hypothetical protein C2E20_7044 [Micractinium conductrix]	KAF8066241.1 hypothetical protein HT031_002564 [Scenedesmus sp. PABB004]
OG0003650	PSC70485.1 tyrosyl-tRNA synthetase [Micractinium conductrix]	KAF8071273.1 Tyrosine--tRNA ligase [Scenedesmus sp. PABB004]
OG0003653	PSC68736.1 tRNA_m_4_X modification enzyme TRM13-like protein [Micractinium conductrix]	KAF8066192.1 TRMT13 [Scenedesmus sp. PABB004]
OG0003654	PSC76599.1 nucleoredoxin 1 [Micractinium conductrix]	KAF8058839.1 hypothetical protein HT031_005407 [Scenedesmus sp. PABB004]
OG0003656	PSC73915.1 Transcription factor CCAAT displacement CDP1 [Micractinium conductrix]	KAF8060046.1 hypothetical protein HT031_004984 [Scenedesmus sp. PABB004]
OG0003657	PSC68700.1 Transcription factor TFIIIB component B [Micractinium conductrix]	KAF8072547.1 bdp1 [Scenedesmus sp. PABB004]
OG0003658	PSC73712.1 Serrate RNA effector molecule [Micractinium conductrix]	KAF8055817.1 hypothetical protein HT031_006592 [Scenedesmus sp. PABB004]
OG0003659	PSC71500.1 HPP family [Micractinium conductrix]	KAF8071025.1 hypothetical protein HT031_001107 [Scenedesmus sp. PABB004]
OG0003660	PSC69645.1 hypothetical protein C2E20_6876 [Micractinium conductrix]	KAF8069546.1 hypothetical protein HT031_001663 [Scenedesmus sp. PABB004]
OG0003661	PSC71437.1 von Willebrand type A [Micractinium conductrix]	KAF8064522.1 viaA [Scenedesmus sp. PABB004]
OG0003662	PSC68735.1 DNA topoisomerase 6 subunit A [Micractinium conductrix]	KAF8065951.1 TOP6A [Scenedesmus sp. PABB004]
OG0003663	PSC70434.1 carboxylate clamp-tetratricopeptide repeat [Micractinium conductrix]	KAF8069556.1 RPAP3 [Scenedesmus sp. PABB004]
OG0003664	PSC69603.1 NADH dehydrogenase [Micractinium conductrix]	KAF8058094.1 NDC1 [Scenedesmus sp. PABB004]
OG0003665	PSC69577.1 nuclear transcription factor Y subunit C-3-like [Micractinium conductrix]	KAF8065657.1 NFYC4 [Scenedesmus sp. PABB004]
OG0003668	PSC69909.1 glutamine-dependent NAD_+_ synthetase [Micractinium conductrix]	KAF8062623.1 glutamine-dependent NAD_+_ synthetase [Scenedesmus sp. PABB004]
OG0003669	PSC73441.1 Restriction endonuclease type II-like [Micractinium conductrix]	KAF8058321.1 rplW [Scenedesmus sp. PABB004]
OG0003670	PSC76866.1 ALWAYS EARLY 3 [Micractinium conductrix]	KAF8062087.1 UBE2T [Scenedesmus sp. PABB004]
OG0003674	PSC69393.1 mRNA-decapping enzyme subunit 2 [Micractinium conductrix]	KAF8072918.1 DCP2 [Scenedesmus sp. PABB004]
OG0003675	PSC72550.1 putative S-acyltransferase 17 [Micractinium conductrix]	KAF8061172.1 PAT17 [Scenedesmus sp. PABB004]
OG0003676	PSC72418.1 ribonuclease III [Micractinium conductrix]	KAF8066206.1 mrnC [Scenedesmus sp. PABB004], KAF8069626.1 mrnC [Scenedesmus sp. PABB004]
OG0003678	PSC69233.1 carotene isomerase [Micractinium conductrix]	KAF8065591.1 hypothetical protein HT031_003192 [Scenedesmus sp. PABB004]
OG0003680	PSC71897.1 Nucleoporin GLE1 [Micractinium conductrix]	KAF8066412.1 GLE1 [Scenedesmus sp. PABB004]
OG0003682	PSC70494.1 spermine oxidase-like [Micractinium conductrix]	KAF8059129.1 PAO1 [Scenedesmus sp. PABB004]
OG0003683	PSC68296.1 putative S-adenosylmethionine carrier chloroplastic isoform X1 [Micractinium conductrix]	KAF8060543.1 SAMC1 [Scenedesmus sp. PABB004]
OG0003684	PSC75615.1 E3 ubiquitin-ligase AIP2 [Micractinium conductrix]	KAF8066286.1 AIP2 [Scenedesmus sp. PABB004]
OG0003688	PSC73179.1 haloacid dehalogenase-like hydrolase superfamily [Micractinium conductrix]	KAF8066387.1 PYRP2 [Scenedesmus sp. PABB004]
OG0003689	PSC74928.1 ubiquitin-like modifier-activating enzyme ATG7 [Micractinium conductrix]	KAF8067168.1 Atg7 [Scenedesmus sp. PABB004]
OG0003690	PSC75831.1 Sterol-4-alpha-carboxylate 3-decarboxylating [Micractinium conductrix]	KAF8068313.1 Nsdhl [Scenedesmus sp. PABB004]
OG0003691	PSC70292.1 E3 ubiquitin-ligase RNF14 [Micractinium conductrix]	KAF8064657.1 Rnf14 [Scenedesmus sp. PABB004]
OG0003692	PSC73207.1 Isochorismatase domain-containing 2 [Micractinium conductrix]	KAF8073015.1 isoc2 [Scenedesmus sp. PABB004]
OG0003694	PSC69135.1 RNA RNP complex-1-interacting phosphatase [Micractinium conductrix]	KAF8067198.1 pir-1 [Scenedesmus sp. PABB004]
OG0003696	PSC70103.1 Syntaxin-81 [Micractinium conductrix]	KAF8059460.1 SYP81 [Scenedesmus sp. PABB004]
OG0003697	PSC68272.1 Pentatricopeptide repeat-containing [Micractinium conductrix]	KAF8067263.1 RH22 [Scenedesmus sp. PABB004]
OG0003698	PSC73750.1 no exine formation 1 [Micractinium conductrix]	KAF8058100.1 hypothetical protein HT031_005760 [Scenedesmus sp. PABB004]
OG0003699	PSC72904.1 Transmembrane and coiled-coil domain-containing 1 [Micractinium conductrix]	KAF8072969.1 tmco1 [Scenedesmus sp. PABB004]
OG0003700	PSC75515.1 hypothetical protein C2E20_1661 [Micractinium conductrix]	KAF8072428.1 Low molecular mass early light-inducible protein HV90 [Scenedesmus sp. PABB004]
OG0003701	PSC68009.1 serine arginine-rich splicing factor SR45-like [Micractinium conductrix]	KAF8063837.1 SR45 [Scenedesmus sp. PABB004]
OG0003705	PSC73174.1 NADH dehydrogenase [ubiquinone] iron-sulfur mitochondrial [Micractinium conductrix]	KAF8055760.1 NDUFS4 [Scenedesmus sp. PABB004]
OG0003706	PSC74504.1 dihydrofolate synthetase [Micractinium conductrix]	KAF8064668.1 hypothetical protein HT031_003470 [Scenedesmus sp. PABB004]
OG0003707	PSC69034.1 lycopene epsilon chloroplastic [Micractinium conductrix]	KAF8061096.1 LUT2 [Scenedesmus sp. PABB004]
OG0003708	PSC71584.1 Magnesium transporter [Micractinium conductrix]	KAF8065428.1 MgtE [Scenedesmus sp. PABB004]
OG0003709	PSC70186.1 Serine carboxypeptidase-like 49 [Micractinium conductrix]	KAF8055337.1 CBP3 [Scenedesmus sp. PABB004]
OG0003713	PSC74830.1 multifunctional methyltransferase subunit TRM112 At1g22270 [Micractinium conductrix]	KAF8069418.1 TRM112B [Scenedesmus sp. PABB004]
OG0003714	PSC76538.1 putative GTP diphosphokinase chloroplastic [Micractinium conductrix]	KAF8056227.1 RSH2 [Scenedesmus sp. PABB004]
OG0003716	PSC71096.1 maternal effect embryo arrest 18 [Micractinium conductrix]	KAF8065956.1 pnp [Scenedesmus sp. PABB004]
OG0003717	PSC75792.1 melanoma-associated antigen G1 [Micractinium conductrix]	KAF8069522.1 hypothetical protein HT031_001639 [Scenedesmus sp. PABB004]
OG0003718	PSC74823.1 isopentenyldiphosphate delta-isomerase [Micractinium conductrix]	KAF8065582.1 hypothetical protein HT031_003183 [Scenedesmus sp. PABB004]
OG0003719	PSC74514.1 Phycocyanobilin_ferredoxin oxidoreductase [Micractinium conductrix]	KAF8066305.1 pcyA [Scenedesmus sp. PABB004]
OG0003720	PSC72738.1 CCR4-NOT transcription complex subunit 4 [Micractinium conductrix]	KAF8073187.1 CNOT4 [Scenedesmus sp. PABB004]
OG0003721	PSC71182.1 uridine kinase [Micractinium conductrix]	KAF8059450.1 uridine kinase [Scenedesmus sp. PABB004]
OG0003723	PSC72731.1 Hedgehog isoform 2 [Micractinium conductrix]	KAF8057679.1 NPC1 [Scenedesmus sp. PABB004]
OG0003725	PSC76512.1 sulfite reductase [NADPH] alpha-component [Micractinium conductrix]	KAF8064690.1 redA [Scenedesmus sp. PABB004]
OG0003728	PSC68940.1 signal recognition particle receptor subunit beta-like [Micractinium conductrix]	KAF8063052.1 Srprb [Scenedesmus sp. PABB004]
OG0003729	PSC75213.1 thyroid adenoma-associated-like protein [Micractinium conductrix]	KAF8072500.1 hypothetical protein HT031_000159 [Scenedesmus sp. PABB004]
OG0003730	PSC76991.1 carboxyl-terminal-processing peptidase chloroplastic [Micractinium conductrix]	KAF8071053.1 ctpA [Scenedesmus sp. PABB004]
OG0003732	PSC68931.1 DNA-damage-repair toleration chloroplastic-like [Micractinium conductrix]	KAF8059737.1 DRT111 [Scenedesmus sp. PABB004]
OG0003734	PSC76819.1 hypothetical protein C2E20_0698 [Micractinium conductrix]	KAF8070955.1 OSB4 [Scenedesmus sp. PABB004]
OG0003735	PSC74064.1 ATP-dependent metalloprotease [Micractinium conductrix]	KAF8064612.1 ftsH [Scenedesmus sp. PABB004]
OG0003737	PSC68111.1 P-loop containing nucleoside triphosphate hydrolase [Micractinium conductrix]	KAF8064631.1 KIN14M [Scenedesmus sp. PABB004]
OG0003738	PSC74795.1 3 saliva family [Micractinium conductrix]	KAF8061081.1 hypothetical protein HT031_004541 [Scenedesmus sp. PABB004]
OG0003739	PSC75394.1 ATP-dependent Clp protease proteolytic subunit [Micractinium conductrix]	KAF8056144.1 clpP [Scenedesmus sp. PABB004]
OG0003742	PSC75659.1 NF-X1-type zinc finger NFXL2 [Micractinium conductrix]	KAF8057277.1 NFXL2 [Scenedesmus sp. PABB004]
OG0003743	PSC74153.1 HAD-like domain [Micractinium conductrix]	KAF8055736.1 hypothetical protein HT031_006640 [Scenedesmus sp. PABB004]
OG0003747	PSC76399.1 F-box SKIP16 isoform A [Micractinium conductrix], PSC76398.1 F-box SKIP16 isoform B [Micractinium conductrix]	KAF8060480.1 SKIP16 [Scenedesmus sp. PABB004]
OG0003749	PSC70109.1 SPOC and transcription elongation factor S-II domain [Micractinium conductrix]	KAF8072662.1 hypothetical protein HT031_000322 [Scenedesmus sp. PABB004]
OG0003750	PSC67912.1 putative ADP-ribosylation factor GTPase-activating AGD8 [Micractinium conductrix]	KAF8063087.1 RAD51B [Scenedesmus sp. PABB004]
OG0003751	PSC68116.1 hypothetical protein C2E20_8282 [Micractinium conductrix]	KAF8065436.1 hypothetical protein HT031_003037 [Scenedesmus sp. PABB004]
OG0003752	PSC72768.1 SNARE associated Golgi [Micractinium conductrix]	KAF8058068.1 TVP38/TMEM64 family protein [Scenedesmus sp. PABB004]
OG0003754	PSC75606.1 KTI12-like protein [Micractinium conductrix]	KAF8062921.1 KTI12 [Scenedesmus sp. PABB004]
OG0003756	PSC72707.1 TATA-binding -associated factor 172 [Micractinium conductrix]	KAF8067380.1 BTAF1 [Scenedesmus sp. PABB004]
OG0003757	PSC68679.1 hypothetical protein C2E20_7761 [Micractinium conductrix]	KAF8072514.1 hypothetical protein HT031_000174 [Scenedesmus sp. PABB004]
OG0003759	PSC72927.1 hypothetical protein C2E20_4027 [Micractinium conductrix]	KAF8057654.1 hypothetical protein HT031_006003 [Scenedesmus sp. PABB004]
OG0003761	PSC72702.1 vacuolar sorting-associated 9A-like [Micractinium conductrix]	KAF8057621.1 VPS9A [Scenedesmus sp. PABB004]
OG0003762	PSC72811.1 TPX2-like isoform X3 [Micractinium conductrix]	KAF8068442.1 TPX2 [Scenedesmus sp. PABB004]
OG0003765	PSC71889.1 Flavin reductase-FMN-binding domain containing [Micractinium conductrix]	KAF8072997.1 ywrF [Scenedesmus sp. PABB004]
OG0003767	PSC72840.1 50S ribosomal chloroplastic [Micractinium conductrix]	KAF8071244.1 rplX [Scenedesmus sp. PABB004]
OG0003769	PSC72605.1 exocyst complex component sec10 [Micractinium conductrix]	KAF8067429.1 SEC10a [Scenedesmus sp. PABB004]
OG0003774	PSC72097.1 peroxisome biogenesis 1 isoform X1 [Micractinium conductrix]	KAF8072429.1 PEX1 [Scenedesmus sp. PABB004]
OG0003775	PSC71154.1 vacuolar sorting-associated 24-like protein 1-like [Micractinium conductrix]	KAF8067204.1 VPS24-1 [Scenedesmus sp. PABB004]
OG0003776	PSC72062.1 plastid fibrillin 3 [Micractinium conductrix]	KAF8062755.1 PAP4 [Scenedesmus sp. PABB004]
